id,user_id,movie_id,stars,content,created_at
626,28,47,2,Particularly need start per important model.,2025-04-22 18:35:40
627,10,757,4,Force bring federal physical sister yourself possible several.,2025-01-10 18:04:07
628,30,202,4,Travel research less simply long how.,2025-03-20 22:33:15
629,2,711,1,Morning actually it movement subject assume race positive trip.,2025-03-18 08:10:59
630,2,492,4,Certain rock life although eye case may control time.,2025-03-04 14:22:59
631,15,846,1,Whatever every someone recognize item west relate.,2025-01-07 23:29:05
632,9,407,2,Shake research general organization office customer then itself truth drug.,2025-04-06 15:08:20
633,3,980,1,Probably policy tell least.,2025-02-13 13:42:35
634,5,517,3,Finish rest face range beyond shoulder.,2025-02-07 00:19:47
635,7,584,2,Side pressure my play.,2025-03-26 18:38:49
636,28,771,3,Item mother marriage national social camera safe eye.,2025-01-16 22:10:34
637,12,429,2,Cut sister occur character study amount camera.,2025-03-19 07:14:39
638,2,895,4,Address next American sometimes miss instead show pretty director story.,2025-01-14 03:25:53
639,15,425,5,Run general exist call easy use early.,2025-02-05 12:09:29
640,10,597,5,Again he office himself throw add whose dream service.,2025-04-02 19:30:53
641,28,679,2,He enjoy first result by just Mr around heart evening.,2025-03-31 13:21:31
642,9,285,2,Quickly scientist clear station have politics why.,2025-02-14 07:26:24
643,25,597,5,Tonight south son thus inside give rest bill consider pass.,2025-01-02 02:12:34
644,1,97,5,Of court see recent sea region although operation structure.,2025-03-21 10:43:42
645,8,705,3,Newspaper I test least instead back key.,2025-01-14 03:05:26
646,8,102,3,Black center fill show everybody almost adult sport.,2025-02-24 19:17:15
647,19,411,1,Pm special but contain most air politics movie.,2025-01-18 15:37:14
648,25,658,5,Full yourself hotel hold middle he base more both six safe.,2025-03-19 02:40:19
649,17,715,1,None training along popular culture product.,2025-05-05 16:47:49
650,16,720,2,Just Mrs test former story.,2025-03-05 10:06:47
651,12,981,3,Add Mrs sometimes not art civil.,2025-02-19 05:20:51
652,8,903,1,Senior through prevent stop color.,2025-03-13 19:27:03
653,25,753,3,Past later child approach money life event dinner he almost president.,2025-02-04 07:31:21
654,20,298,5,Son account product son record federal.,2025-03-26 10:47:17
655,12,470,4,Because mouth else story assume home born act hour.,2025-01-20 18:58:28
656,2,183,2,Meeting film hot strong energy wife camera against.,2025-01-29 19:57:52
657,17,244,5,Age moment soon message mention.,2025-02-18 05:29:52
658,8,409,4,Fish per go Mr doctor hear inside tell career.,2025-02-27 00:07:19
659,3,820,3,Song street pass tree democratic include.,2025-04-28 03:46:14
660,26,825,1,Five as exactly employee.,2025-03-15 17:37:08
661,14,890,5,Sign science enjoy heavy financial approach north section series color dark.,2025-03-30 00:54:05
662,1,712,2,Yard worker already concern.,2025-04-22 04:01:58
663,2,835,5,Rate boy later easy interest American main last.,2025-01-23 09:53:23
664,14,20,4,Receive physical level benefit six keep.,2025-03-18 14:53:03
665,10,843,4,Major professional key could sound inside.,2025-03-04 00:27:08
666,20,720,2,Wife before inside choose pay or tax.,2025-01-17 04:11:37
667,5,779,3,Tonight real already field deal than focus day.,2025-01-15 03:29:22
668,15,624,2,Wait level call near animal.,2025-04-02 07:52:43
669,26,395,3,Himself maintain Republican dog stage we plan sometimes fast.,2025-05-02 02:59:18
670,26,633,3,Safe include half usually into.,2025-02-28 13:07:30
671,3,626,3,International attack then hear term will learn much eight writer.,2025-05-02 22:13:07
672,21,823,5,Audience news rest out blue civil.,2025-02-09 17:38:09
673,10,645,4,Military result common audience finally then discover.,2025-01-05 06:20:48
674,29,794,5,Statement ask will oil specific treatment similar no best TV.,2025-01-18 18:20:58
675,17,829,2,Identify night expert century consumer pattern fund if research service.,2025-03-04 04:03:18
676,11,936,5,Little evening majority bag field stock woman board with.,2025-05-05 06:35:13
677,22,411,5,Hotel until will report walk.,2025-04-25 09:32:21
678,18,35,2,Property interesting true across affect listen friend culture card.,2025-03-19 16:43:45
679,10,265,5,Security assume cover car letter activity main plant half box.,2025-01-12 03:59:28
680,14,843,4,Almost hit well bring than mention later number near.,2025-04-11 22:04:22
681,26,838,4,Behavior form born fine project.,2025-02-03 04:09:13
682,12,381,2,Store forward defense which age water former hear.,2025-04-28 01:18:55
683,25,110,2,Life five ready fact itself add last present attention.,2025-02-02 02:07:56
684,30,712,5,Really base accept course.,2025-02-06 03:44:53
685,5,905,4,Old so in media among wait bar hospital.,2025-04-22 13:26:10
686,17,716,1,Mother today recently similar possible issue.,2025-04-22 01:20:37
687,4,387,5,Seven guy else green generation.,2025-03-02 16:56:16
688,19,304,5,Concern exist sport sometimes detail.,2025-01-07 02:41:27
689,15,633,1,May nothing evening spend weight door wear close.,2025-01-11 02:33:13
690,17,610,3,Option certain figure several create.,2025-02-12 00:50:31
691,5,124,1,Enough might difficult term run represent gun design south reality.,2025-01-02 05:10:51
692,1,905,5,Situation capital leader less rate effort remain plant they.,2025-02-14 04:45:49
693,12,304,5,Glass despite recognize believe establish.,2025-05-05 14:48:43
694,11,330,5,More subject affect speech same will next each capital create.,2025-04-19 01:33:39
695,2,516,4,Child similar parent my.,2025-03-23 08:29:40
696,21,971,1,Crime note present something produce safe night.,2025-01-22 05:41:10
697,27,995,5,Present recognize financial better indeed.,2025-04-18 05:40:17
698,25,448,2,Health strong concern region shoulder discuss can trip.,2025-03-20 17:17:52
699,2,911,2,Claim product daughter court agree imagine wife listen.,2025-05-07 16:34:15
700,2,567,1,Guy family hundred sometimes yes no factor we today.,2025-01-09 08:16:46
701,20,18,1,Media thank seem evidence opportunity none your.,2025-04-20 23:34:37
702,17,990,2,Well want career sign discussion take generation cultural weight city.,2025-01-23 17:20:48
703,23,74,2,Talk east civil tend usually town do enjoy behavior.,2025-05-05 05:22:21
704,4,714,2,Mother event environment simple industry all.,2025-04-05 13:39:25
705,16,593,1,Hear heart cause again gun book chair.,2025-04-04 05:23:45
706,23,675,5,Put fill north article purpose wrong total few face.,2025-01-28 09:58:03
707,20,337,1,Bit member hope seek or.,2025-04-26 08:50:25
708,30,696,3,Loss visit partner no year beat probably media.,2025-01-20 20:37:23
709,10,609,4,White opportunity store entire last return PM.,2025-02-04 12:07:27
710,17,116,4,Manage price majority Mr need company.,2025-03-05 05:18:42
711,27,953,1,Include seven interview agent manage teacher stock business history.,2025-02-02 07:46:08
712,14,770,4,Respond our charge little sell already.,2025-01-15 10:46:15
713,1,454,4,General expect civil change.,2025-04-01 22:50:14
714,11,152,5,Room allow know try stop wear across.,2025-01-01 07:45:04
715,19,615,5,Road close growth memory save figure somebody break.,2025-04-23 21:40:52
716,10,753,5,Green politics her own culture loss nation car.,2025-04-28 14:31:50
717,26,30,3,Establish age good push call positive note suffer view family.,2025-04-05 14:23:39
718,24,816,5,Any ability large military among.,2025-04-24 18:10:30
719,17,174,3,Section sense edge message sea ever.,2025-04-04 19:21:04
720,12,267,3,Perform front job such.,2025-02-06 20:05:12
721,3,507,2,Western address media ten candidate picture call scientist hold somebody.,2025-01-16 14:45:31
722,1,240,5,Morning stay claim seek.,2025-01-15 17:03:50
723,2,491,4,Lay my nature range mouth different agent wife various.,2025-04-19 04:49:12
724,15,397,5,Against word doctor hundred wear image generation.,2025-04-14 13:54:43
725,17,698,1,Operation me need student memory room space president.,2025-01-01 06:19:21
726,28,370,2,Local me part meet stock piece.,2025-01-03 08:36:53
727,2,815,1,Food brother reality wrong science tend enjoy.,2025-01-25 03:39:17
728,27,878,2,Beyond may chance some hotel message live.,2025-05-01 09:57:39
729,2,577,5,Here site process top avoid foot she ready always area.,2025-01-24 02:20:10
730,4,703,1,Agree movie growth Mrs yet general Mr win.,2025-01-22 21:50:30
731,10,215,1,Pick age short general girl.,2025-01-30 03:52:55
732,9,467,2,Daughter prevent whose create race trial data.,2025-05-06 22:21:14
733,26,940,3,Say leave pull gas need pay recognize left commercial simple.,2025-01-12 17:13:59
734,14,602,3,Customer spend whom feeling smile but pick.,2025-03-15 10:48:28
735,16,914,3,From it blue guy camera discuss food though walk site gun.,2025-04-10 12:30:07
736,30,811,2,Trip all fly view must administration.,2025-04-27 13:51:54
737,24,312,2,Special southern kitchen brother respond bag national act debate myself direction.,2025-01-10 00:07:59
738,28,615,5,Full military care western fly.,2025-01-06 14:03:32
739,22,113,5,Admit will use write sit already.,2025-01-21 05:34:31
740,5,511,2,Strong detail computer store road year relationship girl attorney.,2025-02-13 14:35:24
741,23,55,5,Figure plan enter determine form book which.,2025-01-12 16:35:42
742,6,771,2,Them understand doctor house week tree out.,2025-02-09 11:57:57
743,25,831,5,Issue second heavy carry guess develop lead prove network control style.,2025-04-09 14:53:07
744,28,924,4,Group Mr indeed best eat memory hand option finally upon.,2025-01-11 13:40:14
745,29,315,1,Act find manage year tonight.,2025-01-01 02:14:30
746,23,391,3,Standard name study itself kind find area.,2025-01-25 21:02:59
747,10,410,4,Safe follow me ask deep once for fly yeah.,2025-03-20 05:57:37
748,2,919,4,Child road region power myself current.,2025-02-05 22:38:47
749,8,944,1,Great prove know difficult property carry.,2025-01-16 04:20:25
750,5,641,5,Which challenge same member leader enough site responsibility.,2025-02-22 16:02:39
751,4,682,4,Meet plant paper president admit television girl force back.,2025-04-24 05:01:34
752,13,51,2,Street military natural western from miss break behavior sort.,2025-02-08 06:43:18
753,24,300,5,Government bring skin think energy.,2025-02-09 09:21:40
754,18,964,4,Result none any heavy attorney leave same Congress develop PM.,2025-02-15 04:23:57
755,23,414,2,Most know moment whole future last.,2025-01-06 05:18:27
756,13,117,2,Doctor fly partner term to win challenge.,2025-04-01 07:48:47
757,21,884,5,Contain then top recently policy.,2025-01-05 06:08:37
758,26,819,1,Collection scene me attorney crime suddenly notice no style pattern eight.,2025-01-03 19:30:29
759,8,351,2,Newspaper month represent friend child.,2025-04-11 07:37:49
760,9,889,5,Food environment performance yes side black media call sense.,2025-02-10 11:14:05
761,26,503,3,Woman system all black stock some court recent.,2025-04-20 17:06:35
762,4,502,3,Radio upon as particularly single could of former film.,2025-01-26 07:28:35
763,5,741,5,And visit type prepare media suggest method easy security couple.,2025-02-21 17:56:52
764,26,672,3,Agreement own question explain set.,2025-04-18 01:45:25
765,18,550,3,Perhaps economic bank in life wall west.,2025-02-09 21:05:10
766,23,554,2,Bring this possible however ever member factor.,2025-02-22 21:23:47
767,3,799,5,None he stock cold together.,2025-03-22 05:56:34
768,30,303,2,Want institution difficult million production throughout choose employee.,2025-02-18 17:00:03
769,15,986,1,Ready card first once daughter option pretty.,2025-02-12 11:48:06
770,8,195,5,Arrive relationship American strong executive large newspaper.,2025-04-13 20:19:32
771,8,926,1,Everyone may body figure mention near leg.,2025-01-17 11:13:55
772,21,173,2,Speech television focus professional rather leave.,2025-01-26 05:46:56
773,4,301,3,Hard draw according better answer.,2025-04-12 05:16:13
774,24,894,3,Voice join pretty create each yeah bar thought money off.,2025-01-30 02:26:48
775,16,298,2,Home develop now test nor.,2025-02-03 04:43:14
776,11,918,1,Health teacher skin which can.,2025-02-15 05:22:17
777,13,62,1,Boy be you bill claim everything appear bank hotel nearly.,2025-02-14 17:00:58
778,20,353,3,Bank degree southern character break garden various lead serve part understand.,2025-04-14 04:57:40
779,26,135,1,Trial group cause live cost everything thank.,2025-01-25 16:53:52
780,15,416,2,Clear month church TV present catch take this total alone.,2025-04-07 16:35:51
781,20,767,3,Week available clearly leave meet.,2025-02-20 07:44:01
782,17,344,3,Quickly build trip rule for nature key.,2025-04-26 23:52:48
783,10,701,4,Seven news but could collection full nor.,2025-02-21 01:35:55
784,8,554,2,Seven our policy impact parent.,2025-01-24 17:33:52
785,18,575,4,Else movement throw benefit usually officer when arrive high.,2025-02-19 12:27:50
786,18,178,1,Nice Republican owner according despite make.,2025-04-20 23:45:27
787,16,256,5,Mean finish cover scene production close million source quite.,2025-04-20 01:45:11
788,6,60,3,Live people painting follow value.,2025-01-09 13:27:35
789,24,66,2,Friend only nothing official relationship every specific paper activity.,2025-05-07 15:10:22
790,17,284,3,Thank bar allow tend space interesting staff land certainly.,2025-01-16 06:05:54
791,10,261,3,Visit best society better agree low case budget.,2025-04-05 08:06:17
792,25,404,1,Enter success environmental suggest travel thought coach.,2025-01-03 19:53:06
793,19,555,1,Score both wear set friend maintain determine answer get.,2025-04-07 11:26:32
794,20,826,2,Establish standard feeling through dream.,2025-04-04 02:54:00
795,8,782,2,Across far boy no receive many practice.,2025-04-11 03:35:43
796,25,19,3,Begin without around kitchen prevent likely enter.,2025-03-12 16:41:46
797,26,451,4,In able drive expect her imagine any law perhaps.,2025-02-01 07:45:36
798,20,920,3,East hour hold modern station grow visit white believe cut dream.,2025-03-06 06:00:15
799,26,28,5,Century behind whatever reach deal race behind eat office attention customer.,2025-03-08 17:56:53
800,19,764,2,Through let marriage read song.,2025-03-02 04:56:00
801,28,826,5,Bad office include arrive daughter military.,2025-02-04 21:33:31
802,16,888,1,Yourself read join guess girl while deep ok.,2025-04-27 17:13:13
803,10,273,3,Congress camera public partner career cause.,2025-03-27 15:23:24
804,13,691,4,Anything interest look anyone hundred international peace score.,2025-02-09 15:06:34
805,12,666,4,Training cold for expect offer.,2025-04-04 17:34:27
806,1,444,2,Small property sort song almost occur standard security.,2025-04-21 23:45:53
807,15,809,1,Indeed no interest per eight defense television.,2025-04-30 09:52:28
808,1,640,2,Third forward kid total kind gun goal support.,2025-03-07 05:05:09
809,28,185,1,Around during difference tax however.,2025-04-03 00:46:25
810,2,272,1,Avoid generation lay much effort manager side.,2025-05-08 17:48:18
811,29,318,5,Buy off follow see day maybe thousand order.,2025-05-07 03:46:47
812,12,196,3,Two pay section method author page let.,2025-03-01 13:09:34
813,10,49,3,Dream enough find federal.,2025-04-06 23:30:09
814,2,17,4,Discover information arrive ground rich.,2025-04-02 11:23:18
815,11,469,1,Real week again hospital concern rock response media.,2025-03-21 02:38:51
816,24,307,4,Worry take huge discuss traditional fear sea audience pay.,2025-02-05 23:55:34
817,24,231,4,Party number listen relationship according without any around there.,2025-03-20 18:30:21
818,9,267,5,Fear live imagine necessary hope.,2025-04-01 17:54:07
819,13,280,1,Administration check national other return test answer citizen whole beat.,2025-02-24 22:02:02
820,24,405,2,Him result coach artist main detail hear focus.,2025-02-03 08:25:50
821,29,705,1,Consumer discuss professional large have.,2025-03-26 19:54:47
822,21,432,3,Throughout meeting note myself drop they laugh strong performance writer.,2025-02-02 21:43:09
823,25,904,4,Plant yes put question so weight.,2025-04-30 19:56:38
824,3,201,1,Still sure court movie right loss.,2025-03-20 04:40:35
825,1,894,4,Guy medical election daughter bit red no north true blood.,2025-04-10 00:16:14
826,13,48,2,At draw moment act environment.,2025-03-02 15:51:44
827,28,545,3,This business nothing hundred nor drug on despite treat forward of.,2025-01-25 15:44:17
828,22,653,5,Behind apply activity chance hour yard so from.,2025-01-19 06:12:01
829,24,663,2,Technology body professional learn increase claim person involve.,2025-01-20 18:59:22
830,5,335,4,Coach fill suffer say five research list.,2025-01-29 13:02:21
831,7,23,1,Difficult yeah hard across project cup five many they.,2025-02-13 15:43:54
832,2,868,3,Study move none life look evidence establish international likely.,2025-03-13 17:44:08
833,10,182,1,Now cell drug fill generation.,2025-01-30 07:19:41
834,1,845,3,Civil generation character hair various foreign budget Republican believe pay.,2025-04-28 07:09:13
835,14,907,5,Surface reason score while indeed summer defense as degree.,2025-01-10 00:22:28
836,7,895,1,After provide under subject finally finish more build international.,2025-02-26 06:38:09
837,27,640,4,Fear oil see series almost by week old.,2025-02-26 23:37:11
838,13,802,2,West institution something size behavior your try.,2025-01-13 07:37:07
839,14,451,4,Today magazine put carry back build present paper few analysis.,2025-02-11 18:09:57
840,11,536,2,Travel somebody around remain despite.,2025-02-17 23:43:49
841,17,856,1,Friend build keep million research million toward new peace wish.,2025-04-23 20:18:58
842,9,241,2,Increase cause position month.,2025-04-24 15:55:49
843,23,589,4,Close former hundred real deal hour report.,2025-01-18 17:22:14
844,2,335,1,Early blood board while exactly.,2025-01-30 20:16:25
845,17,340,4,If wonder level deep soldier bit.,2025-02-10 02:48:21
846,1,15,2,List thus own until doctor management voice provide general.,2025-02-05 08:04:05
847,21,488,3,Live night sell resource certain.,2025-01-20 21:27:04
848,22,234,5,Race high particularly cover low member wait admit economy.,2025-05-07 04:02:59
849,25,889,5,Toward surface hope military walk most.,2025-04-13 00:52:59
850,13,206,4,As degree base maybe rule green.,2025-01-27 07:50:28
851,18,388,1,Can term help apply maybe yourself.,2025-03-28 22:00:16
852,29,270,3,Forward population relationship difficult computer.,2025-03-16 19:28:52
853,26,925,3,Win man hundred price happy miss.,2025-03-29 14:23:37
854,17,994,5,Alone generation enjoy time take.,2025-03-11 03:33:25
855,25,82,4,Same score see glass garden three sit.,2025-04-08 01:15:16
856,14,858,2,Town few war first save agreement time.,2025-02-05 05:53:41
857,26,778,2,Image reveal young lawyer Congress century build account.,2025-04-11 11:47:30
858,26,797,1,Oil majority husband whole idea.,2025-01-30 20:36:55
859,11,229,1,Still blood structure modern cold role feeling support discuss.,2025-02-23 00:09:10
860,20,538,5,From major risk interest letter necessary.,2025-01-01 14:19:24
861,11,539,3,Consider lose above result state beautiful pass again education receive.,2025-01-11 03:09:19
862,23,526,2,Real place wonder front build entire movement play image everything.,2025-05-05 16:28:52
863,11,704,1,Skin political day drop.,2025-01-10 19:13:17
864,30,307,4,Box hold discover more inside get election magazine million.,2025-05-03 15:01:59
865,12,693,2,Institution coach thank guy entire.,2025-04-13 12:59:58
866,4,256,4,Medical occur surface between inside reason Democrat simple week blue.,2025-04-24 18:11:56
867,15,879,5,Action these rock player director task over item memory.,2025-01-20 03:21:58
868,20,590,2,Rich southern skill performance.,2025-02-22 11:40:11
869,28,773,4,Early rock either style lawyer year perhaps.,2025-02-22 07:51:29
870,15,254,4,Sign model movie certainly scientist religious to.,2025-05-03 18:24:49
871,17,278,2,Style plant hear tough physical.,2025-03-10 17:28:01
872,22,530,1,Reduce whose south spend thousand hand.,2025-02-10 17:23:48
873,22,946,5,State opportunity never voice do ten.,2025-03-17 08:44:35
874,25,59,4,Hundred such spring partner others help executive address individual pull.,2025-04-18 13:13:14
875,22,84,3,Improve energy mouth current wonder process majority exactly.,2025-04-30 12:13:57
876,20,721,2,Necessary call effect medical degree civil lead information.,2025-01-22 06:07:08
877,16,47,4,Fact dark painting cost response.,2025-02-21 09:33:43
878,25,602,1,Summer discuss he eye get wait see against.,2025-04-19 18:42:15
879,3,100,5,Us with agency member former visit film month condition.,2025-03-20 02:12:05
880,18,411,4,Your discover certainly fish prevent.,2025-02-24 01:01:30
881,14,976,5,Process major information arm be or cold.,2025-04-18 10:09:48
882,3,394,5,Field tough year develop painting society manager institution rise near.,2025-02-20 01:46:23
883,27,23,3,Discuss machine month happen yard.,2025-03-23 21:54:43
884,25,807,3,Agency certainly nor he.,2025-02-04 07:26:45
885,11,753,2,Company history official pick many director Republican.,2025-04-04 21:16:57
886,11,759,2,Conference front ago behind authority ball.,2025-05-05 12:58:14
887,7,238,3,Adult wonder network keep game true factor against.,2025-04-02 21:12:15
888,19,1000,1,Goal dog there trade establish attention religious hold degree American fear.,2025-02-07 12:13:07
889,16,512,3,Ground sit former central wonder state including require couple table.,2025-03-05 11:50:30
890,2,664,3,Whom argue between its live phone.,2025-01-27 02:14:24
891,8,214,4,Maybe why their somebody begin investment young store.,2025-05-08 17:54:01
892,9,633,2,Today act full note ago read produce marriage back move which.,2025-02-06 14:16:36
893,1,55,4,Attention author north industry see different.,2025-04-18 18:10:30
894,27,477,3,Especially within dark by finish second young.,2025-02-27 23:17:17
895,28,777,1,Rise window hit impact it head this.,2025-02-27 19:14:26
896,9,417,1,Strategy pattern listen argue soldier floor song themselves.,2025-02-17 15:49:24
897,27,241,3,Church involve candidate give unit.,2025-01-08 13:56:57
898,8,463,4,Never everything whether young authority black everything newspaper.,2025-03-23 05:58:48
899,27,591,1,Heavy town treat stop tax world fear it.,2025-04-04 20:16:42
900,30,896,1,Notice economy join wide step site discuss parent heart range.,2025-04-03 23:01:58
901,28,276,3,Government table north value prevent indicate fast show high nor.,2025-04-20 15:42:55
902,25,549,4,Quickly although opportunity owner north sport next through dream.,2025-05-02 20:17:10
903,22,338,1,Design purpose market base within option hear.,2025-01-07 13:47:26
904,20,848,4,Prepare trial beat scientist stuff real.,2025-03-31 14:26:18
905,20,482,2,School exactly until get remain garden.,2025-02-12 05:43:19
906,4,753,5,Watch price picture piece range process anyone stage standard open.,2025-03-20 08:55:16
907,25,834,3,Decade hundred budget drive white.,2025-04-01 02:52:58
908,3,873,2,Social seek often figure magazine four seven economy international.,2025-04-20 22:21:52
909,24,98,1,Prepare stuff again pull piece series.,2025-04-20 20:29:56
910,28,616,1,Moment consumer respond reality generation language my around.,2025-03-30 21:44:00
911,24,83,5,Bar traditional recently culture.,2025-02-27 18:09:18
912,24,201,2,Remember seven item experience chair in future.,2025-02-08 06:29:08
913,22,837,1,Police break run strategy speech parent rather career.,2025-01-09 15:36:00
914,2,405,1,Whom environmental evidence science dog statement trouble.,2025-02-21 14:31:26
915,23,314,4,Sea course son head his.,2025-01-06 04:07:11
916,24,966,5,Chance rule action must nice wall short.,2025-04-04 03:12:39
917,6,683,4,Central late wall develop current group without head page hope.,2025-03-27 21:27:30
918,1,43,2,Writer station should stay amount today someone.,2025-01-07 05:19:46
919,12,104,4,News arrive main learn sure fill throughout without player beyond senior.,2025-02-20 19:39:48
920,2,286,1,Avoid soon again five agreement figure.,2025-01-10 02:44:10
921,9,384,1,Indeed reality government it huge check case investment important.,2025-03-07 08:10:47
922,12,362,3,Order must anyone water same late together.,2025-03-10 22:00:46
923,27,472,4,Under moment although American need theory black factor.,2025-05-05 21:22:55
924,2,916,4,Most much be material rock commercial quickly value again over.,2025-03-11 14:37:08
925,4,216,1,Explain laugh onto per window.,2025-04-07 07:51:06
926,11,949,2,Simply week arrive policy draw enter guess civil.,2025-02-16 12:39:04
927,5,1,3,Where another month force throw on.,2025-03-24 01:32:37
928,7,677,5,Matter writer tax study get.,2025-01-10 18:56:43
929,30,15,3,When newspaper wonder successful value.,2025-04-19 07:11:44
930,4,559,2,Pattern total along about court friend citizen memory pass.,2025-02-11 10:44:13
931,16,67,2,Majority institution turn talk step western author music away husband particular.,2025-02-14 05:07:51
932,24,324,1,Participant amount dog network candidate class.,2025-04-09 13:54:56
933,12,627,4,Beautiful marriage everyone north amount us beat something as whatever three.,2025-01-23 20:46:12
934,4,886,3,Air new cold together child.,2025-05-05 06:48:29
935,8,799,5,Much build marriage religious sell.,2025-01-29 14:28:16
936,9,332,4,Threat from their statement experience family.,2025-01-04 17:54:48
937,3,346,3,Party everyone sea before American add.,2025-01-20 01:14:46
938,13,672,4,So try across space ball.,2025-01-18 05:56:50
939,4,352,3,Not firm at total may.,2025-01-08 14:11:39
940,28,996,1,End factor clear try interest source they.,2025-02-15 06:43:25
941,25,216,4,Beautiful man your wind maybe a term.,2025-03-09 22:23:06
942,3,30,1,Most security huge institution win world.,2025-02-23 05:11:43
943,3,796,2,Level hard modern tough at firm.,2025-01-13 16:07:55
