id,user_id,movie_id,stars,content,created_at
944,21,927,2,Music century care forward yes age none why serve turn bar.,2025-02-18 13:08:47
945,20,780,5,Opportunity art black behind whether.,2025-04-09 10:36:19
946,4,289,4,Type so few both get assume.,2025-01-18 13:33:32
947,16,956,2,Could when concern within.,2025-04-11 14:06:14
948,19,323,3,Order medical cause doctor no population.,2025-04-25 07:40:15
949,23,106,1,Offer region such board save finally them trouble.,2025-01-18 13:27:11
950,15,314,5,Board agency she behavior across.,2025-04-23 04:46:34
951,4,368,4,Safe wind bank rise add amount.,2025-03-10 14:11:05
952,8,583,2,Today out successful seat employee minute sit often fund number.,2025-04-03 11:31:30
953,11,383,4,Type different statement way.,2025-03-22 00:26:11
954,3,931,5,Bank onto have air trade human.,2025-02-06 22:37:54
955,11,809,3,During college whole year scene democratic available painting financial.,2025-02-18 08:08:45
956,13,85,4,Modern rest state painting not base move machine travel bed.,2025-03-30 05:33:29
957,11,548,2,Pressure model take rule reflect boy.,2025-01-12 19:17:23
958,10,429,5,Late for finally hope.,2025-02-24 16:59:47
959,11,184,2,Yard respond hand film treatment race blood.,2025-01-20 10:52:46
960,21,811,3,Common deep charge young health opportunity within inside form pay.,2025-02-04 16:32:21
961,30,213,3,Community table certainly discussion try grow operation act authority.,2025-04-13 12:52:30
962,13,417,5,Approach party we sport alone.,2025-03-27 10:39:17
963,23,78,3,Whole here woman oil art assume mouth until claim space.,2025-03-30 19:24:42
964,2,591,3,Season option fish treatment remain practice five increase agency seek.,2025-02-16 05:57:33
965,25,762,3,Beyond marriage center agent every station learn organization image rule center.,2025-01-24 08:20:35
966,8,353,1,Truth believe product general office create consider.,2025-01-13 00:22:03
967,11,457,5,Kitchen nor military move sometimes identify thing fill.,2025-02-01 07:52:32
968,27,569,2,Building from still soon newspaper help.,2025-01-15 04:58:54
969,27,112,5,Left cup industry call learn level.,2025-03-28 08:26:42
970,19,759,2,Life get letter institution prepare price gun material attorney.,2025-02-27 01:32:39
971,3,148,2,First there move beautiful buy itself other become discussion.,2025-03-27 10:50:48
972,9,155,2,Mrs understand just medical right serious.,2025-03-22 13:35:08
973,13,634,4,To house perform public administration less wall.,2025-02-22 04:24:51
974,15,713,2,Course common watch common affect light third none sometimes vote.,2025-03-07 20:00:42
975,22,361,4,Eight federal maybe suggest family control check within spring.,2025-01-11 06:14:17
976,18,426,5,Left ok bill industry establish.,2025-04-26 15:53:24
977,24,227,4,Design himself help speech college worry analysis police.,2025-04-26 11:34:41
978,14,211,2,Knowledge suffer moment rise respond affect although old.,2025-04-07 21:47:29
979,8,572,3,Not available Democrat factor but happy manager piece.,2025-02-28 18:43:06
980,11,555,3,Improve performance clear store machine at difficult hospital family manage.,2025-05-06 09:12:57
981,12,144,1,Yet military money produce toward onto.,2025-04-19 03:26:36
982,9,580,4,Hear his place name.,2025-02-27 17:17:45
983,23,639,4,Two air continue same professional front responsibility safe.,2025-03-07 19:59:48
984,20,941,1,Father ground picture group north view father.,2025-01-19 14:48:11
985,27,219,1,Task under check night majority.,2025-02-28 01:51:41
986,25,126,1,Life opportunity loss after ahead short and hundred me.,2025-03-18 08:02:15
987,13,230,5,Miss establish picture federal interview hour.,2025-03-16 08:25:23
988,18,889,2,Available song back cover provide ever science door side sure.,2025-01-02 11:40:42
989,1,742,3,Kitchen particularly seven as guy generation case stage.,2025-02-16 06:47:14
990,24,162,4,Some out natural hotel happy increase impact head employee.,2025-03-18 17:51:34
991,1,909,1,Say join himself here however its partner firm to.,2025-01-13 09:41:12
992,7,842,3,Able guess effort win city miss story manage strategy.,2025-02-12 00:53:14
993,5,391,3,Set maintain manage town house learn.,2025-02-17 18:47:03
994,13,102,3,Item spend office campaign name price environmental decide foreign situation.,2025-03-19 16:01:06
995,2,102,2,Experience consumer entire gun successful now full yard.,2025-02-26 01:30:06
996,5,793,5,Smile this drive garden usually administration show plant cause.,2025-03-17 13:53:13
997,30,670,2,Great be price eight develop parent.,2025-02-04 15:30:35
998,14,675,4,Career know south share blood.,2025-02-24 23:58:09
999,10,566,1,Street just know safe visit.,2025-05-01 14:08:45
1000,24,122,3,Already above rise collection nation treat cost industry.,2025-02-15 22:45:46
1001,3,74,5,If action movement common air.,2025-03-14 03:29:52
1002,8,455,5,Agent year lead baby matter exist painting number free east.,2025-01-30 12:53:01
1003,20,653,1,Bring happen through organization job law on other.,2025-04-18 11:57:41
1004,10,576,1,Behind design Congress the game spend along business yourself.,2025-05-08 00:22:00
1005,30,823,4,Adult mother base especially send.,2025-04-27 04:44:14
1006,4,538,1,Will structure past effect else country shake.,2025-01-02 18:09:12
1007,26,924,1,Mission cut within skill country.,2025-05-08 17:39:25
1008,21,241,1,Local decide look arrive see half lot hope it become.,2025-03-29 01:49:57
1009,3,179,4,Car dream increase purpose those.,2025-01-30 12:39:46
1010,9,909,4,Consumer contain identify always you long military consumer manager environmental.,2025-02-10 13:04:31
1011,6,644,4,Mean matter wall no.,2025-03-01 02:23:29
1012,6,544,2,Green story well catch table home brother personal manage fire.,2025-05-04 18:34:38
1013,12,920,1,Language drop model others generation.,2025-04-14 16:38:48
1014,30,873,5,Leave when front without shake remain yes himself.,2025-03-11 15:18:29
1015,15,429,3,Stay without me name perhaps example reach.,2025-02-22 18:39:32
1016,28,24,5,Theory anything model newspaper want.,2025-02-05 06:19:16
1017,21,857,2,Discussion style close write ever adult option.,2025-04-07 02:22:06
1018,7,396,3,He perform present wish however cost laugh miss rather challenge.,2025-01-22 21:01:42
1019,23,18,4,Pull tree interesting church lawyer tree knowledge source.,2025-03-24 10:43:23
1020,29,524,3,According either but remain message level drug.,2025-04-05 20:47:01
1021,19,299,3,These here like behind type size recognize room.,2025-01-31 00:05:41
1022,11,376,5,Some market there present discover.,2025-03-01 14:27:45
1023,3,170,4,Indeed behind hot peace expect team administration wish not article.,2025-03-14 14:16:19
1024,18,893,1,Size financial boy west hand case ahead push standard father.,2025-03-10 12:04:45
1025,25,868,2,Use shake machine talk reduce.,2025-04-21 17:09:33
1026,15,331,5,Cut lead economic detail test back.,2025-02-28 16:32:58
1027,19,737,1,Former society position around suffer can.,2025-03-22 16:59:47
1028,12,837,2,Compare international focus sister rest generation raise play.,2025-03-01 12:33:58
1029,17,220,5,Just ok peace require.,2025-03-08 12:06:07
1030,25,281,4,Trial century director stay pay see age expert would respond.,2025-03-02 17:52:11
1031,6,83,4,Other lose both sure environment control.,2025-02-09 01:52:23
1032,17,507,3,Sure before attack significant actually billion continue event camera often.,2025-04-26 03:21:31
1033,16,950,5,Culture boy participant dream level.,2025-03-26 22:02:30
1034,27,635,5,When news behind yes treat four seek instead.,2025-03-01 19:58:56
1035,20,448,2,Land control writer what page hard guy teach talk.,2025-02-08 04:30:44
1036,2,51,1,Property take technology appear bar light.,2025-02-01 05:45:01
1037,27,987,1,Ahead trouble student good candidate through push.,2025-04-22 17:05:49
1038,27,978,1,Mr run religious accept region entire week break.,2025-03-16 02:38:06
1039,22,771,5,Close within threat those head quite view safe.,2025-02-04 07:47:40
1040,28,868,1,Effect will nation like take shoulder adult.,2025-03-11 22:24:48
1041,19,393,2,Small music yard growth thank manager.,2025-05-04 23:10:27
1042,8,609,4,At wrong phone see PM carry time.,2025-01-05 02:28:59
1043,12,826,2,Represent machine art analysis finish type board.,2025-04-07 02:45:58
1044,1,699,2,Crime may yard focus treatment theory issue store meeting brother.,2025-02-09 17:19:17
1045,8,948,5,Add concern enough rather agency buy.,2025-04-09 00:44:19
1046,15,664,4,Focus serve per thank candidate paper measure.,2025-03-11 11:04:44
1047,14,347,4,Property fall fear light process listen.,2025-02-20 02:11:27
1048,8,521,5,Every throw before enjoy gas after.,2025-03-05 17:12:35
1049,16,180,1,Research break can serious operation focus.,2025-04-27 10:49:20
1050,17,942,3,Answer if myself pay act certain involve according.,2025-03-26 11:52:24
1051,30,876,3,Institution together hard long feel degree remember begin.,2025-02-28 04:05:10
1052,27,360,4,Real happen shoulder there film effort crime cut former.,2025-01-19 21:31:49
1053,30,616,1,Magazine opportunity bank argue dog rise west figure.,2025-04-14 21:19:59
1054,7,971,1,City standard fine discover treat record open us mission exactly.,2025-04-14 14:57:23
1055,4,194,5,Social analysis especially memory ago could positive candidate man.,2025-04-13 10:30:46
1056,11,615,5,Add tree exactly interest future investment land property.,2025-03-26 17:49:09
1057,29,720,5,People notice education commercial clear certainly let anything.,2025-01-07 22:06:02
1058,1,24,1,Market enjoy could each agency.,2025-03-21 08:57:15
1059,2,479,5,Theory Democrat ahead nor method.,2025-05-02 15:37:14
1060,25,654,1,Whom Democrat act on news travel blood film agreement.,2025-01-21 13:22:36
1061,7,47,4,Them large see identify onto.,2025-02-23 19:24:59
1062,2,175,4,Seek short show really have none read later production style.,2025-04-19 09:44:28
1063,14,820,3,Director network food statement.,2025-01-23 18:48:07
1064,23,617,5,Seat couple whom right might interview mind exist majority church.,2025-04-24 04:17:26
1065,14,385,2,Financial treat serious specific region population present seven paper.,2025-04-20 10:40:52
1066,10,5,3,Exist just series military task fine.,2025-04-03 00:19:31
1067,22,509,3,President friend energy analysis with life since herself build great.,2025-04-10 02:02:10
1068,4,11,4,Believe why various develop market break full parent million.,2025-03-30 14:47:56
1069,30,411,3,Design black chance pay point bed.,2025-01-26 15:29:54
1070,14,717,3,Possible though represent single these.,2025-01-01 03:20:09
1071,15,173,2,Speech even final film.,2025-04-19 17:33:27
1072,15,13,3,Personal card military want director report there store view old.,2025-03-13 13:38:41
1073,24,713,3,Image natural listen generation state understand.,2025-02-24 01:01:11
1074,26,470,1,Team health set treatment require society lot want the situation.,2025-04-05 13:40:58
1075,21,313,4,Help guess law speak.,2025-03-04 00:56:22
1076,26,584,3,You see business put prepare.,2025-04-09 16:28:23
1077,8,152,4,Behind southern surface future top bank service.,2025-01-08 11:54:54
1078,19,117,4,Piece matter pay simple read wall effect way control at local.,2025-02-07 03:13:34
1079,20,383,1,Picture hot discover director many note ability imagine long business.,2025-04-21 05:58:35
1080,10,846,1,Skin smile cultural store of stuff specific stay.,2025-01-22 01:01:06
1081,30,534,5,Economic understand son president reality environment spend.,2025-01-10 19:08:40
1082,29,139,5,Tend strong strategy company clear already standard ask computer.,2025-01-27 17:52:08
1083,21,155,2,Cost phone by back white.,2025-01-06 16:54:08
1084,19,486,1,Report stuff hit but require else manager.,2025-01-12 17:35:22
1085,26,828,5,Building life fall pass talk accept visit seat animal.,2025-02-11 21:57:09
1086,9,170,4,Director back pick soldier soldier later attention will blood.,2025-04-09 00:26:27
1087,8,355,2,According idea heart could daughter man else.,2025-01-30 08:01:05
1088,8,492,5,State what these talk worry against responsibility.,2025-03-14 13:52:54
1089,26,346,1,Room best from market it fish edge.,2025-04-08 04:16:01
1090,5,212,5,Next practice shoulder leg others a compare.,2025-03-22 06:47:25
1091,26,374,3,Doctor sister and care table federal.,2025-02-19 10:46:06
1092,28,941,1,Trial product many type science claim source.,2025-05-02 19:44:26
1093,8,519,5,Age whose anyone lot project.,2025-03-25 14:09:29
1094,11,429,3,What reason save property necessary against term.,2025-03-31 09:41:56
1095,17,947,5,Within forward at really able generation interest including action.,2025-03-17 17:30:33
1096,19,113,4,Statement clearly civil finish mind herself energy we common.,2025-03-17 11:11:10
1097,12,528,5,Set indeed mention feel game child anything prove program ago.,2025-02-28 07:15:05
1098,16,691,3,Change morning population full include whole religious.,2025-04-27 23:21:10
1099,22,362,4,Career note task win language care join lead economy.,2025-01-15 10:23:47
1100,13,485,4,Should strong simple answer machine owner.,2025-03-16 23:00:02
1101,24,559,4,Check federal important throw a prepare knowledge letter all.,2025-02-27 09:47:25
1102,16,685,3,Ground if the describe game table.,2025-01-10 06:16:58
1103,21,820,2,Until her arm him market us.,2025-01-23 11:09:45
1104,5,695,3,Very draw into without organization a that figure.,2025-02-23 02:18:16
1105,19,523,3,Couple themselves sure firm any style agency art.,2025-03-28 18:46:22
1106,3,798,4,Money whose budget necessary whole reveal company difference.,2025-03-16 09:31:00
1107,1,178,4,Particularly subject son president specific section natural soon.,2025-01-23 00:17:30
1108,26,612,3,Economy quality evening ability recognize year decide per.,2025-05-04 12:09:07
1109,14,133,3,Card wonder avoid play woman force.,2025-04-25 11:50:40
1110,27,147,4,Represent however individual guess southern discussion election kitchen.,2025-01-05 14:09:35
1111,22,255,3,Away happen thousand daughter tough base around trouble their certain.,2025-03-13 19:26:18
1112,25,171,2,Myself still realize behind bring determine medical product few.,2025-04-11 08:49:58
1113,12,555,3,Short choice ask here identify so others.,2025-01-22 00:27:20
1114,11,304,2,Serve its reach person half.,2025-02-09 05:51:23
1115,17,807,3,Available government special believe worry.,2025-04-02 21:34:51
1116,7,804,1,Sea practice under suddenly near concern.,2025-01-31 23:06:20
1117,12,537,4,Bad positive decade lead certain major report expert.,2025-05-02 17:01:25
1118,21,748,4,Brother five idea else whole return image outside high most.,2025-01-21 04:05:32
1119,6,245,2,Team day suffer civil cause central movement bar despite.,2025-03-11 06:30:03
1120,2,35,2,Main change deal call series see degree address.,2025-04-26 20:29:37
1121,21,499,3,Although drive since meeting interview agree last friend security most.,2025-01-19 18:17:12
1122,18,200,5,Figure performance officer reality no risk.,2025-02-06 20:49:59
1123,12,113,5,Grow three soon score future.,2025-03-13 15:55:41
1124,27,480,2,Inside stand week return whole page wait leave animal.,2025-02-26 23:07:41
1125,28,445,3,Third child during front day.,2025-02-06 03:10:52
1126,8,775,1,Deep reduce for question read to.,2025-02-14 22:57:17
1127,14,325,5,Lead grow girl second floor lay threat service city.,2025-02-04 00:27:01
1128,13,951,3,Easy attorney short guess TV spring defense.,2025-01-02 10:48:15
1129,16,502,5,Develop couple ground too wife player six party against house mother.,2025-04-26 04:05:42
1130,7,479,5,Of write middle name he always feel.,2025-03-23 06:41:19
1131,17,837,3,Sport sing technology statement stand tonight new.,2025-03-11 15:14:16
1132,22,248,3,Administration prevent phone with water.,2025-01-01 11:44:18
1133,21,868,5,Else could part she push book south day within least old.,2025-02-18 20:26:08
1134,13,4,2,Recently against worker worry score interview.,2025-02-15 04:22:35
1135,28,421,5,While low issue activity under hotel tough threat.,2025-02-17 05:15:53
1136,18,760,5,Family five evening own contain once family.,2025-03-20 20:34:47
1137,7,144,1,Agent media exist meet every manage.,2025-02-13 11:57:23
1138,23,519,3,Want follow weight ready quickly them enough.,2025-03-21 04:59:13
1139,3,244,1,Save board today nation personal community.,2025-05-06 22:51:15
1140,5,482,1,Kid debate last property good natural.,2025-04-01 05:44:12
1141,9,541,5,Out structure international help oil fund school amount Mrs step.,2025-02-11 01:11:56
1142,30,931,4,All it never may industry drop.,2025-03-16 00:21:59
1143,17,738,1,Simple item do word since experience.,2025-03-27 11:19:41
1144,8,643,5,Forget and major animal more road marriage others operation trouble.,2025-03-14 07:54:36
1145,21,392,4,Impact approach learn add against walk record.,2025-01-01 00:33:59
1146,5,904,3,Describe guy ask pass quickly later board.,2025-03-11 21:54:34
1147,12,641,4,Quickly network best popular spend check prevent.,2025-01-29 07:23:12
1148,17,247,5,Simply everyone summer we.,2025-01-22 00:43:23
1149,8,113,1,Bag responsibility product character concern father bed.,2025-02-05 12:29:39
1150,4,315,1,Later show good store against.,2025-03-24 01:30:48
1151,14,346,1,Market radio ability such suddenly cup.,2025-01-29 07:45:16
1152,3,249,3,Area expect describe skin become yard management.,2025-04-10 23:54:28
1153,14,632,1,Head outside effect have according.,2025-05-07 07:22:35
1154,20,16,1,So letter specific shoulder newspaper culture.,2025-03-01 07:05:37
1155,29,90,3,Benefit sign south they finally face act figure.,2025-03-19 02:33:03
1156,15,526,5,Without growth Mr window.,2025-04-02 09:56:36
1157,5,946,1,Compare create special fire parent spend window card tend.,2025-01-19 11:19:42
1158,14,500,4,Describe low group lawyer whole own daughter simple.,2025-04-13 05:10:28
1159,7,830,2,Little turn serious imagine story late knowledge lay.,2025-02-09 03:22:56
1160,24,754,2,Game employee of big else radio third recognize moment.,2025-02-28 10:04:03
1161,26,263,1,Record issue choose peace indicate foot position herself.,2025-02-04 12:24:45
1162,13,464,4,To defense good sit its security myself create.,2025-01-09 13:20:40
1163,21,29,4,Family understand deep everybody list.,2025-01-13 07:13:00
1164,20,498,1,Door learn social candidate their line financial.,2025-04-13 13:22:05
1165,16,11,5,Whether night let turn.,2025-03-30 13:19:05
1166,25,125,1,Manager daughter subject brother drug forget.,2025-03-05 14:21:30
1167,1,885,4,Continue south feeling reason woman friend food.,2025-04-10 06:36:30
1168,11,554,3,Near painting him region live set church.,2025-02-19 22:51:14
1169,25,709,3,That professor deal owner blood fill site single.,2025-04-01 12:43:18
1170,23,813,5,Want white goal age firm.,2025-04-27 09:24:51
1171,12,194,5,Could without do send tax media such eight fear bill.,2025-01-28 22:20:43
1172,23,236,4,Assume need bit herself or enough.,2025-03-02 04:37:49
1173,22,48,1,Thought hear want laugh million there investment effort.,2025-02-18 15:13:55
1174,26,373,3,Fact organization economy task will direction recently do level.,2025-01-06 03:13:46
1175,19,261,5,Evening beautiful second his cultural wait office serious.,2025-02-01 09:38:34
1176,27,197,2,Democratic soldier city accept window.,2025-04-18 12:23:24
1177,9,550,4,Woman be interesting character seek.,2025-02-17 19:24:11
1178,23,723,3,Find contain manage suddenly spring group.,2025-04-30 14:54:15
1179,12,211,2,Suddenly very record positive scientist treat short old lawyer might.,2025-03-21 11:16:32
1180,15,639,4,Perform matter behavior professor look off throughout outside anyone number.,2025-02-23 00:07:47
1181,4,480,4,Station environment majority feel know ground.,2025-04-15 22:42:34
1182,21,752,5,Coach explain fight activity music provide goal box property draw those.,2025-03-08 09:54:16
1183,13,143,3,Those everyone this study computer.,2025-02-14 15:04:38
1184,26,160,2,Good gas current side staff detail provide risk political.,2025-01-25 22:53:43
1185,21,397,5,Democratic sign station certain rule money would provide.,2025-04-10 15:32:36
1186,8,830,4,Continue various tax so discuss low red ten sense tell.,2025-01-04 19:09:47
1187,16,41,1,Identify back respond suffer ask position which benefit.,2025-04-23 11:33:54
1188,3,802,1,Read series ok news buy image world task career.,2025-02-10 01:15:51
1189,8,856,5,Then human threat page find thousand western.,2025-03-14 17:48:07
1190,29,415,5,Money create push gun get long recognize account never.,2025-01-20 07:29:55
1191,19,26,3,No free consider own citizen.,2025-01-18 05:10:48
1192,28,399,1,Suddenly industry of play listen perform bit.,2025-03-16 20:28:20
1193,3,257,3,Degree former player language to public draw six.,2025-03-02 19:32:53
1194,1,538,3,My follow him office scientist character cover success body.,2025-04-16 13:18:26
1195,21,20,2,Age specific some yourself girl main phone statement.,2025-03-23 10:50:04
1196,27,524,4,Agency bring body wife impact.,2025-04-04 01:45:43
1197,18,588,5,Behavior science mean attorney focus deal my maybe public.,2025-03-27 23:11:40
1198,2,350,4,Because class raise clearly.,2025-04-07 02:49:03
1199,28,737,5,Mother strategy pay notice toward.,2025-01-29 16:29:26
1200,29,503,2,Direction receive sport whose task son road popular kitchen road.,2025-04-24 09:27:07
1201,10,657,4,Base us capital least exist join event hold.,2025-04-22 09:07:40
1202,14,445,3,High cost point attorney baby where financial all authority fear.,2025-05-03 10:30:13
1203,30,179,5,Will keep rich could information hair choose black support modern.,2025-02-10 08:41:50
1204,15,728,4,Parent color hard hit fire significant idea certainly.,2025-01-26 14:30:01
1205,10,621,4,Right care professor nor bag rule.,2025-02-13 04:17:11
1206,8,420,2,Safe common time maybe why today real.,2025-01-06 10:41:25
1207,11,91,2,House once he television last tonight stay without thousand.,2025-02-09 16:29:48
1208,10,988,1,Themselves less it audience food grow avoid history gas break.,2025-02-14 06:35:34
1209,12,131,5,Teacher fight parent PM particularly personal spring.,2025-04-25 21:58:21
1210,4,953,3,Although worry better tell avoid.,2025-01-06 20:03:21
1211,8,859,1,Data suddenly option say gun I evening.,2025-01-04 12:44:42
1212,25,727,5,Reality meet good read raise pressure upon very goal.,2025-04-09 23:20:30
1213,23,836,1,Home conference imagine business people thousand.,2025-03-20 00:03:03
1214,28,275,3,Parent serve hand raise director real.,2025-04-08 09:52:34
1215,17,410,3,Area word design decade brother top guy staff.,2025-01-08 03:57:17
1216,19,367,4,Congress wish few oil.,2025-02-22 05:27:58
1217,2,158,2,Remember simple treat away service professional message player follow peace.,2025-02-01 18:44:25
1218,2,3,1,Shoulder color street meeting sister.,2025-02-01 06:14:56
1219,9,112,4,Day entire laugh information.,2025-02-14 08:21:31
1220,1,401,3,Student picture seek sign example effect if easy of rate process.,2025-03-06 18:42:50
1221,29,43,5,Young tree conference travel fast rich else watch tax away road.,2025-05-06 22:43:41
1222,3,875,5,According perform close during any.,2025-02-16 09:39:50
1223,8,115,2,Plan around player provide effect which choose.,2025-01-22 11:30:27
1224,15,536,5,Town ability lead step site approach which part.,2025-02-12 20:29:41
1225,28,481,3,Party beautiful end fight fly themselves process recent beyond artist.,2025-03-27 20:13:44
1226,9,594,3,Assume food foot around less watch us economic yet.,2025-01-19 05:31:25
1227,29,648,1,Man sing age huge program enough.,2025-03-17 07:09:42
1228,18,945,4,Experience his doctor officer arm even.,2025-01-30 06:14:21
1229,15,378,5,Model than religious individual entire young compare actually kind dream.,2025-04-24 18:06:06
1230,7,576,2,White agreement important media send project American.,2025-04-12 14:18:42
1231,12,455,4,Of agree even power six music next of democratic soon.,2025-04-25 16:29:31
1232,19,226,3,Address into involve long future event fund loss color provide.,2025-01-08 09:40:20
1233,9,367,4,Next avoid each either laugh nation assume involve section.,2025-04-05 00:06:06
1234,18,211,5,Carry name type prevent parent mind out this have subject.,2025-01-15 04:22:11
1235,6,946,1,Bill community safe including sit decision woman close expect.,2025-01-02 10:51:48
1236,2,757,1,Anything cup democratic stuff third yet less whole world.,2025-01-15 15:32:53
1237,27,349,5,Next nearly civil degree wide to kid career mention ball.,2025-01-18 04:33:00
1238,4,663,4,Office near what see part much choice left better book.,2025-01-31 01:14:35
1239,25,472,4,Style last rate pay ever people land blue.,2025-03-28 08:32:59
1240,10,284,4,Wait how which deep character area page address draw.,2025-02-26 06:13:20
1241,18,191,5,To action hot hear prove break cell.,2025-05-07 03:26:09
1242,27,939,2,Compare movie want seek social charge eight history catch.,2025-03-25 11:42:39
1243,27,868,2,Among turn boy with magazine step impact like general person product.,2025-02-24 06:19:17
1244,1,788,1,Expert rock watch should compare upon agency.,2025-04-13 02:11:24
1245,18,30,3,Food art manager boy somebody.,2025-04-05 00:31:32
1246,14,948,2,Someone later word community behavior why word job ok.,2025-01-20 17:26:36
1247,21,246,3,Talk risk laugh decide and man table tax themselves rate.,2025-03-15 18:50:49
1248,1,397,3,He southern low space.,2025-04-27 10:46:25
1249,3,752,2,Through build his radio weight.,2025-02-08 01:44:23
1250,27,956,3,Past similar store themselves deal live game appear tend difference.,2025-01-14 06:58:48
1251,5,860,4,Billion say open level which close.,2025-05-03 04:04:20
1252,13,710,2,Among enjoy where husband present such into.,2025-04-16 23:27:39
1253,25,127,4,Instead upon physical data prepare plant.,2025-02-09 05:33:07
1254,12,959,1,Score check clear piece development.,2025-02-13 00:34:08
1255,18,131,4,Wife almost today draw Mrs bit key clear treat the movement.,2025-02-10 17:00:29
1256,11,551,2,Begin fight play travel prevent.,2025-04-25 04:40:38
