id,user_id,movie_id,stars,content,created_at
316,16,855,1,Fill thing so fill check difficult strong soon set including.,2025-02-18 01:46:46
317,24,359,2,Song floor difficult authority seem according game matter animal.,2025-04-11 23:34:57
318,20,907,5,Drive pull business table another sure challenge land.,2025-04-06 02:39:05
319,8,337,3,Market land follow reach strong any cover business mother carry.,2025-01-14 15:19:08
320,6,451,3,Herself car walk here opportunity Congress.,2025-04-04 23:53:01
321,20,601,2,Face middle real whatever take majority her.,2025-01-31 02:54:24
322,29,349,5,Forward inside change window represent create.,2025-02-27 11:31:13
323,9,513,4,Choose member tend large guy recently be.,2025-01-26 07:54:54
324,9,913,1,You question song near teach table money grow article fly.,2025-04-06 14:36:20
325,27,225,5,Size amount significant true occur even never age remember.,2025-03-21 05:51:12
326,17,347,2,Career small six baby week understand food subject.,2025-01-14 08:05:29
327,4,887,2,For nor cup particularly close amount safe account system.,2025-01-24 19:59:16
328,7,649,3,Million suggest few affect interest.,2025-02-28 14:54:04
329,30,451,2,Book however the avoid still address.,2025-04-30 20:55:25
330,17,778,2,Set lose play kind lay expect training tell carry worry as.,2025-04-08 01:20:14
331,7,542,4,My no training off discover low.,2025-05-03 05:01:21
332,27,834,5,Main send life represent country.,2025-01-13 17:30:55
333,3,459,1,Win work partner by police western would throughout.,2025-05-02 23:11:31
334,6,449,3,Measure heart record word hand energy.,2025-02-16 03:10:26
335,20,278,3,Business candidate after image population week family according card.,2025-04-10 20:27:03
336,25,306,2,Control resource between hospital success own relationship table memory.,2025-05-01 17:24:24
337,14,903,1,Behavior could challenge visit push explain visit how unit per something.,2025-05-07 18:43:55
338,1,841,5,Nearly sister compare happy food then method want every building.,2025-01-05 07:23:10
339,27,884,2,Without paper protect activity hope dream.,2025-02-28 21:48:58
340,24,221,5,Story explain president meet professor offer voice discuss hotel.,2025-01-06 08:49:04
341,12,998,3,Sense I finally recent personal.,2025-03-10 11:35:10
342,4,644,1,Bank page he consumer sister wife.,2025-04-03 19:06:44
343,19,180,2,Lead something bag beyond toward work war.,2025-05-02 17:30:10
344,3,287,5,Daughter gas ten over list partner his foreign.,2025-01-24 03:14:42
345,14,209,4,Argue think he forward hear product.,2025-01-01 20:57:15
346,13,339,2,Then relationship sure nothing blood wrong face.,2025-03-29 23:03:22
347,23,170,1,Anyone only week then party.,2025-02-14 07:40:59
348,8,749,4,Difference store improve television more.,2025-04-05 05:48:30
349,21,742,5,War pressure also effect support focus.,2025-01-31 15:03:31
350,4,170,3,Professor employee three consumer dark move.,2025-04-01 09:43:25
351,15,658,4,Know like staff throughout for school between site.,2025-04-22 10:53:31
352,19,385,1,Wear ask effect full college stay of game fill natural.,2025-02-25 21:23:05
353,29,851,1,Government hotel less poor set.,2025-04-08 18:02:23
354,4,861,3,More degree situation certain wind chair list interesting environmental daughter.,2025-01-10 15:54:42
355,18,47,2,Energy manager program over democratic modern go itself technology.,2025-03-27 12:53:28
356,22,773,1,Life several economy whom nearly police report performance mention.,2025-01-14 15:49:20
357,8,182,3,More fact movement recent husband role first.,2025-04-03 00:54:43
358,23,263,2,Through probably service those yourself behavior above according.,2025-03-01 22:13:23
359,12,420,1,In story police everyone.,2025-04-02 13:23:33
360,15,653,5,Guess line then kind take model responsibility.,2025-02-21 02:04:54
361,2,299,3,Sister certain fine stock movement.,2025-02-10 12:41:04
362,22,956,1,Provide difference character choose word might concern that.,2025-01-27 22:44:24
363,17,96,1,During manager her personal save law nothing protect never oil there.,2025-04-16 12:21:09
364,12,468,4,By key whole current establish audience than.,2025-04-03 08:44:54
365,5,425,4,Still soon side west seek.,2025-01-05 05:56:09
366,16,61,1,Event food about paper beat fact analysis rate method.,2025-04-05 05:25:34
367,9,64,4,Control clear parent whom buy ago water why view either.,2025-03-16 07:09:22
368,23,25,2,Protect law whatever wall impact defense task.,2025-03-12 01:15:45
369,17,845,1,This majority short also news research long.,2025-03-26 14:28:38
370,14,266,2,Opportunity rest where pull whatever happy.,2025-04-10 09:13:05
371,6,381,1,Pretty skill network message color far us close everyone consumer.,2025-03-25 20:02:54
372,21,941,1,Teach record environmental marriage catch sell list behind.,2025-01-25 10:28:28
373,29,667,5,Star third street ahead social.,2025-02-17 13:06:19
374,8,694,5,Although water yes story tend term book.,2025-02-08 06:41:33
375,25,652,3,Serious century usually as degree performance environmental ask dog article.,2025-01-22 01:21:37
376,25,364,2,Send focus staff course coach own huge director foreign kitchen including.,2025-03-10 18:20:14
377,22,110,2,Trip them employee right camera these.,2025-04-28 05:25:10
378,11,988,5,Relate way line with subject close last according.,2025-04-28 06:45:38
379,2,540,5,Reveal must across ago hit church third.,2025-02-16 21:24:23
380,9,922,2,View enjoy here hundred political.,2025-02-12 01:56:54
381,25,767,1,Amount happen prevent mission keep low book play indeed in.,2025-03-18 00:12:55
382,26,728,2,Piece start understand style process kind student history together.,2025-02-07 05:28:06
383,11,697,4,Few major pick imagine.,2025-01-20 02:58:44
384,18,53,1,Hold indeed religious claim performance material would.,2025-03-27 13:52:50
385,3,789,2,Show nice least interest recognize something weight pressure four let dark.,2025-04-22 06:08:05
386,13,37,2,Pick action in attack person.,2025-02-01 12:49:50
387,15,866,3,Policy apply media without ball quickly meeting born.,2025-02-16 03:56:57
388,29,115,3,Congress matter each game.,2025-05-02 11:39:00
389,5,852,3,Ask safe finally style wish bank wrong international building green.,2025-01-14 05:01:41
390,13,848,2,Leg shoulder I field popular late.,2025-05-04 09:14:15
391,3,693,5,Wait loss modern who may five staff.,2025-01-23 01:17:16
392,6,103,4,Class industry get likely capital.,2025-04-21 17:10:13
393,6,304,5,Than month on couple we their.,2025-04-06 13:48:41
394,30,810,5,Establish factor his produce stand social.,2025-04-27 01:31:47
395,15,874,3,Gun stage never energy although.,2025-01-11 15:46:32
396,9,692,1,Rule someone get hand little anything until sister case issue.,2025-03-20 14:28:45
397,18,165,3,Strong join less condition all.,2025-04-23 18:01:16
398,17,795,3,Other right through accept return strategy.,2025-03-22 12:26:46
399,10,73,2,Chance list take central culture seem team group thank floor.,2025-04-26 03:57:56
400,19,128,3,Agreement leader bad travel south garden station degree.,2025-03-13 09:32:42
401,16,469,2,Yet mention pass entire note.,2025-04-29 16:08:57
402,24,105,2,Morning soon reach out TV conference environment create message.,2025-02-04 02:31:29
403,19,403,2,Onto pass street result top tonight tough memory.,2025-03-07 00:22:58
404,13,400,2,Management with series long build fly left nice.,2025-04-26 14:20:25
405,25,714,2,Available current become others skin instead far safe recent interest.,2025-05-03 11:26:05
406,10,937,5,Radio staff no color against move commercial move now.,2025-03-05 23:23:17
407,16,671,2,None agreement economy technology simply themselves dark could middle seven yard.,2025-03-25 15:03:09
408,10,21,2,Task doctor true center own its sense population.,2025-04-02 18:27:27
409,11,652,2,Term statement Democrat enough company them.,2025-01-09 06:46:06
410,19,771,2,General long hope about hard call billion mind.,2025-03-01 21:40:11
411,16,571,4,Standard box audience simply nothing.,2025-03-29 19:47:07
412,27,167,5,Child focus kitchen down role strong officer hundred move within.,2025-04-18 20:48:31
413,16,969,5,Reduce over case large whatever adult culture join eye.,2025-02-02 09:48:06
414,25,532,3,Sea quality so view good hour current action ten fall.,2025-05-07 03:23:05
415,3,803,1,Exist sometimes management again us everything however respond guy.,2025-02-13 14:29:54
416,6,994,2,Low floor order personal blood a whatever third rate body.,2025-05-06 19:39:21
417,18,237,1,Form nature point here free every not democratic.,2025-01-22 03:13:21
418,27,464,5,Rate return teacher total window hotel prevent knowledge right turn.,2025-03-17 19:06:08
419,10,816,5,Drive western interest billion analysis remember.,2025-03-09 14:30:51
420,18,692,2,Light behavior building American.,2025-01-28 03:51:53
421,25,480,2,More truth that its arm.,2025-03-04 17:50:06
422,15,508,2,Speech situation as friend shake these yard.,2025-01-19 21:27:32
423,13,161,4,Camera there everyone total amount question executive conference civil approach.,2025-05-01 13:08:59
424,9,959,3,Degree of example among appear opportunity production teach tough student.,2025-01-01 03:42:37
425,7,306,1,Investment first experience civil pay man.,2025-03-10 06:19:39
426,17,944,3,When whole necessary whom send.,2025-03-01 00:48:38
427,22,141,1,Attack near night soon coach unit democratic cut make quickly.,2025-03-24 21:35:26
428,21,935,1,Art page modern dark never election decade series argue set.,2025-01-02 09:30:15
429,12,950,5,Station better day cold together word report avoid site any help.,2025-04-16 15:00:13
430,15,201,1,Worker recent statement that how we change.,2025-03-12 07:55:18
431,13,106,5,Lose who available cover serve week be class whom wrong.,2025-02-14 07:21:00
432,22,598,2,Prevent five floor spring phone economy significant rest I and environment.,2025-04-30 01:56:49
433,2,480,2,Action room I strategy base education beat growth.,2025-01-23 03:49:17
434,28,272,3,Organization fund must woman bill seat serious just learn sea.,2025-02-18 06:41:20
435,29,3,1,Within author court city voice level what trouble father my.,2025-03-16 15:01:23
436,30,390,1,Another accept human top.,2025-01-19 06:46:31
437,30,56,2,Individual office ready live radio traditional rise community either.,2025-02-15 10:42:02
438,15,183,1,Beat senior activity rule development magazine.,2025-01-05 10:08:53
439,12,79,4,Month effort admit down image lose as help seem president.,2025-03-05 07:52:39
440,26,837,3,Some quickly race follow step.,2025-04-22 10:08:26
441,27,433,1,Chair water door power upon live threat toward entire.,2025-03-09 23:52:48
442,12,47,1,Knowledge if more something choice film economy radio according game.,2025-03-08 06:32:16
443,21,104,4,Small right indicate test dream during.,2025-04-10 13:58:06
444,5,300,3,Somebody improve according benefit body short raise.,2025-01-07 11:28:12
445,14,33,3,Low coach not local else.,2025-03-28 15:57:36
446,17,864,1,World thus notice environment guy animal hour business.,2025-03-23 22:42:03
447,19,456,3,Mother within tonight win low among agent under.,2025-02-01 12:42:12
448,17,265,5,Bar bag defense friend board.,2025-01-10 21:25:41
449,6,980,4,Our drive dream once television.,2025-01-03 07:44:49
450,8,917,5,Send buy during art old body hotel they collection exactly.,2025-02-13 04:39:47
451,17,755,4,Hear trouble poor contain.,2025-01-26 02:10:01
452,19,78,2,Than term letter probably central work.,2025-02-10 03:25:14
453,19,414,1,Size he manage eat parent Congress use.,2025-03-02 02:00:03
454,21,160,1,Drug receive lose year around central yard letter.,2025-02-09 00:43:42
455,2,446,3,Line account public house list pay his student every medical.,2025-05-07 22:22:03
456,5,12,4,Look responsibility plan own term nearly by.,2025-02-05 16:59:46
457,22,828,4,Effect interesting team your after card.,2025-02-07 11:13:23
458,4,750,2,Quality edge war nearly him his democratic close improve good.,2025-04-18 08:12:18
459,3,913,3,Important city feeling meeting third politics partner everything traditional per.,2025-02-26 07:44:46
460,29,690,5,Box simple market soon loss here week carry.,2025-01-02 11:23:42
461,15,600,2,Project recently single husband policy coach yet organization on before.,2025-05-05 15:35:39
462,24,457,5,Anyone letter then threat mission cause nor down he.,2025-04-23 13:52:42
463,30,588,2,Message term project radio approach situation power need product consider yes.,2025-01-14 19:16:37
464,25,664,2,American scientist sound picture process against individual vote lay five.,2025-04-22 20:35:02
465,19,922,1,Serious especially eye especially price build.,2025-03-10 21:16:46
466,24,860,2,Training room light figure floor family free skill.,2025-02-26 09:34:42
467,28,861,1,Amount loss wide impact.,2025-02-09 19:47:34
468,24,232,3,Street account writer assume push during could finally yard.,2025-02-15 03:24:38
469,23,258,1,Always table find city decide especially by think far.,2025-01-18 03:01:58
470,2,626,5,Force friend house hand seven player real.,2025-02-18 06:44:24
471,24,749,4,Owner the ever enjoy throw.,2025-01-31 18:42:24
472,30,821,1,Already protect training save cell name.,2025-01-11 18:49:14
473,8,166,5,Nation me those position national clearly movement someone PM.,2025-02-20 01:35:12
474,6,951,5,Off son close network from crime.,2025-05-05 17:46:46
475,13,711,4,Whatever four fight result class almost know.,2025-03-25 12:20:56
476,12,894,5,Everybody method herself imagine table.,2025-02-15 04:16:49
477,8,547,1,South sure coach finally wear couple.,2025-01-19 08:35:46
478,12,704,3,Thousand enjoy let letter whole usually style nice back.,2025-04-19 21:33:25
479,14,95,4,Contain explain piece environmental ever opportunity whom treat chair.,2025-04-28 18:53:12
480,21,500,1,Move article likely seat away which few peace rock according.,2025-04-22 02:33:27
481,5,863,3,Summer worry your military partner local race what.,2025-03-26 23:58:45
482,17,100,4,Help how art significant want summer reason song contain prevent.,2025-03-23 20:04:13
483,17,885,3,Stock begin peace this hotel quite.,2025-02-25 13:44:09
484,27,129,1,Authority live and choose bed learn.,2025-01-29 06:26:14
485,28,12,2,Statement around here record seat activity remain medical determine.,2025-04-26 07:42:43
486,27,205,1,Table administration speech apply example dog make everybody affect.,2025-04-23 01:28:18
487,21,477,5,Bill policy responsibility radio operation onto tax fact finish information.,2025-03-01 07:25:01
488,2,461,1,Conference system campaign between one.,2025-03-26 11:20:26
489,1,324,3,Entire within economy to culture up.,2025-01-07 18:06:56
490,7,796,2,Including art notice choose enjoy approach ready five himself.,2025-03-06 18:07:54
491,21,187,5,Almost car when girl significant since send across.,2025-01-26 05:19:41
492,6,212,4,Month especially soldier thought sense brother mission center.,2025-01-02 11:08:30
493,19,717,3,Song miss by environment service tough movement watch better commercial.,2025-01-11 16:26:10
494,15,256,2,Kitchen citizen large team two expert cost several bring according.,2025-05-06 07:55:05
495,23,766,5,Late book center plan writer.,2025-03-09 09:58:16
496,12,500,5,Point shoulder feeling visit can hospital.,2025-04-19 00:35:01
497,22,857,1,Old include result though main relationship western general will traditional bank.,2025-04-23 07:24:37
498,29,126,3,Address them give technology allow and run.,2025-03-13 22:20:52
499,22,410,3,Through method local you upon field what range sit.,2025-01-05 12:37:46
500,26,471,4,Finish reveal run value quickly increase in seven.,2025-02-21 17:47:11
501,10,653,5,Service authority heart president out wrong reality lose team.,2025-01-02 01:51:30
502,6,186,2,Contain name require employee hundred.,2025-01-15 04:15:49
503,11,1000,2,Nation individual court high white three enter indicate.,2025-02-27 20:33:53
504,2,148,5,Go step individual computer instead drive become today garden.,2025-02-26 02:20:52
505,22,640,3,Reach father central effort city avoid democratic movie.,2025-01-13 20:05:37
506,4,344,4,Think follow some animal prevent mention image.,2025-04-10 23:48:19
507,17,417,1,Key season like cultural.,2025-03-25 09:44:37
508,24,786,2,Including shake expect last maybe security home key design carry.,2025-03-06 07:12:27
509,11,310,3,Now one difficult back medical voice.,2025-04-04 09:34:03
510,28,677,5,Remember us break page out really decide should.,2025-04-24 18:50:49
511,14,497,4,Choose consumer show mean civil some open.,2025-04-15 21:27:04
512,17,892,5,American would pick discussion herself participant well deal arm budget.,2025-04-18 00:02:32
513,12,423,4,Everything when trade magazine political.,2025-01-26 06:56:57
514,6,88,4,Fact ten political yeah vote ball himself scientist.,2025-03-05 17:58:57
515,21,950,3,Vote media future long program.,2025-03-17 20:58:47
516,18,714,2,She avoid doctor child fund push woman occur above huge.,2025-04-12 20:49:57
517,25,268,1,Her question fill in free.,2025-01-03 01:19:34
518,1,908,1,Both go message religious lot plan security him sell improve.,2025-03-25 11:59:09
519,2,487,5,Walk may true coach ever yard design particularly price perhaps.,2025-03-29 22:52:05
520,25,68,5,Still high kitchen with citizen.,2025-01-22 21:36:44
521,8,897,3,Call involve another else hundred leg cover kitchen.,2025-05-02 15:28:14
522,5,608,3,One morning season woman seven their manage no officer clearly.,2025-04-29 13:18:57
523,1,117,5,Media hot line prepare reveal many data.,2025-05-05 15:55:18
524,3,430,1,I push born something action well notice cut.,2025-02-08 10:54:09
525,14,681,1,Manager great admit character create full matter southern response deal.,2025-01-19 03:58:25
526,3,543,2,Lose see any TV staff list what value general.,2025-01-14 20:44:34
527,10,518,1,Media bring none away down.,2025-03-12 07:15:38
528,14,549,2,Election two night Mrs skill.,2025-01-01 17:24:14
529,30,139,3,Measure if enjoy responsibility then rest son law single.,2025-04-26 14:18:17
530,8,452,1,Direction agree huge threat deep single safe go.,2025-02-13 06:36:28
531,7,807,3,Through price hit book study relationship still garden.,2025-04-11 20:51:04
532,11,769,2,Another like interesting create audience traditional.,2025-03-23 19:51:54
533,25,559,5,Indicate be travel step shoulder ahead simply expert lawyer west.,2025-02-15 09:55:30
534,15,251,4,Model simple or world edge.,2025-03-13 08:31:08
535,7,609,3,Lot road consider fill doctor provide guess many the know reason.,2025-04-14 16:48:24
536,8,167,3,Over society move specific trade list current time student.,2025-05-06 04:05:50
537,25,481,4,Win thank full would account as support begin operation week.,2025-03-05 17:28:33
538,20,989,2,Professor practice institution school.,2025-02-06 12:14:56
539,28,237,3,Chance mission very according already our near language.,2025-04-26 14:22:10
540,30,852,4,Real pull agreement general dog.,2025-02-09 14:20:38
541,8,751,3,Happen move himself part far.,2025-02-10 09:47:02
542,8,861,2,Push trial beautiful enough note.,2025-03-21 03:33:30
543,12,940,1,Question catch fight instead exactly outside yes structure focus.,2025-03-19 04:57:17
544,2,428,3,Take down family when cup month week home war agree under.,2025-02-12 11:56:27
545,15,940,4,Sea case sister wall station continue knowledge.,2025-01-25 18:24:20
546,27,750,5,Easy book Congress contain international soldier short right.,2025-03-22 00:41:59
547,8,713,2,Begin physical specific step draw right position.,2025-04-10 10:57:35
548,14,905,3,Box moment less technology cover different station program month dinner.,2025-04-23 06:07:28
549,21,492,1,More new both capital window mention tonight land far.,2025-04-16 09:27:33
550,24,182,5,Accept establish vote everything miss Republican any risk leader.,2025-03-19 04:15:25
551,21,284,5,Draw worry camera treat final him accept lot television.,2025-01-04 20:28:35
552,12,203,1,Never save among different much get quite national.,2025-04-23 04:28:25
553,27,751,1,Easy child cell wall.,2025-02-13 03:28:35
554,27,922,3,Far administration position memory outside every since smile represent happen.,2025-03-24 09:00:00
555,19,974,1,Agent sell television north difference page in present.,2025-02-12 23:07:41
556,7,397,5,Hear claim respond very detail deal up foreign pull police thing.,2025-01-03 09:37:04
557,19,137,5,Candidate range campaign miss door just less task high.,2025-02-21 18:12:34
558,24,768,2,Myself strategy election above century decide assume soldier while once.,2025-02-28 03:13:12
559,6,620,1,Speech different method expert positive walk.,2025-03-04 02:17:43
560,22,156,3,Offer south anyone two peace young accept expert marriage office.,2025-03-21 09:46:39
561,23,817,5,Dinner thank memory I fish him save.,2025-01-27 06:38:17
562,11,807,2,Often modern seek peace five practice building unit teacher.,2025-03-18 13:43:45
563,5,309,2,Art term behavior white prevent interest after another sure new.,2025-03-22 20:43:49
564,8,364,1,Manage sign clearly treat detail seven.,2025-04-11 16:06:27
565,26,554,3,Material job air reach follow.,2025-03-05 03:33:23
566,29,404,5,Win draw production but method.,2025-01-09 21:13:05
567,12,740,3,If science time get back grow month only series.,2025-04-10 00:30:44
568,10,939,4,Wait outside second free general mouth.,2025-01-09 11:57:43
569,18,966,1,Kitchen couple care where room exist body senior.,2025-04-19 01:42:02
570,18,152,2,Measure shoulder offer industry task recognize owner various something often.,2025-04-14 03:33:59
571,18,306,1,Agreement risk challenge common the human experience.,2025-02-11 22:40:21
572,18,896,2,Fall by machine side particular.,2025-04-23 12:19:48
573,29,681,4,Year until expect significant notice reality professional.,2025-03-02 18:08:03
574,11,963,5,Pull Mr cut budget table think myself know discussion night.,2025-01-24 17:26:35
575,20,348,3,Indicate become require listen at try authority choice together campaign.,2025-03-25 13:08:13
576,8,88,5,Pattern behavior power source effect grow paper tax growth.,2025-04-11 04:08:23
577,14,720,2,Some manager accept great short head catch.,2025-01-28 06:09:58
578,17,98,5,Clear employee explain popular foot thank agency reduce.,2025-02-24 11:04:56
579,14,540,3,Receive receive strategy interview difference.,2025-03-29 11:40:46
580,5,758,4,Treat too appear rule she anything herself.,2025-02-13 06:02:45
581,1,719,4,Reflect people future kitchen have edge certainly discover above listen.,2025-01-29 16:44:07
582,24,296,2,Democrat such page soon senior.,2025-02-08 20:21:30
583,1,924,4,Hospital trouble sing safe analysis five cup a.,2025-02-08 17:46:19
584,17,625,1,Stop some sort tell rich maintain.,2025-03-14 22:33:29
585,28,619,3,West wide want follow north bank space.,2025-03-23 01:23:20
586,21,829,5,Mother above moment good key to large reveal game science.,2025-02-03 02:23:18
587,6,891,1,Realize really treat resource glass position keep bank child ground.,2025-02-08 08:47:28
588,9,148,2,Alone home small return nothing.,2025-01-25 03:38:02
589,17,704,5,Majority cup produce history nation.,2025-04-03 03:38:45
590,30,358,4,Them record finally want choose number a.,2025-03-03 23:46:20
591,20,200,2,Idea join ball learn loss.,2025-03-04 22:47:04
592,30,452,4,Air see western personal senior second reflect.,2025-05-06 04:40:09
593,7,537,3,Either human low move war play.,2025-05-04 04:21:48
594,1,235,2,Yard game capital unit politics.,2025-01-06 00:18:46
595,28,669,1,Likely Democrat long record sit interview police fill feel.,2025-01-15 19:35:18
596,23,618,4,Opportunity rather picture inside individual hit threat girl those.,2025-01-19 08:19:54
597,22,242,2,Whom sign security west happen we cold paper.,2025-01-23 15:08:32
598,17,600,1,On political sign member ready.,2025-03-26 20:48:09
599,3,795,2,And health social entire simple long shake training.,2025-02-24 05:42:43
600,5,680,1,Suffer sport rich last away shake maybe word.,2025-04-04 09:58:29
601,3,816,5,Instead past add customer future technology surface sort project base.,2025-02-04 13:30:09
602,19,294,5,Power without unit hot various professional top first since.,2025-02-02 03:07:03
603,6,22,3,Environment somebody few game three number indicate low.,2025-01-11 22:09:02
604,15,16,3,First crime current nor hour among his treatment.,2025-03-29 06:19:41
605,15,701,1,Reflect fast travel range culture economic environment major usually away.,2025-03-10 04:33:52
606,24,652,5,Threat above put development design onto I hot.,2025-03-20 03:37:02
607,18,57,2,Defense add audience off city.,2025-03-11 06:16:26
608,26,640,3,Push example include magazine hospital often pass stuff Republican recent.,2025-04-25 03:23:26
609,23,643,5,Physical past relate measure manage camera lead project.,2025-01-18 12:56:50
610,19,612,5,War last father under its wind citizen listen know ever.,2025-02-23 02:44:03
611,26,589,2,Speak decade fire tax authority partner assume.,2025-03-29 01:17:26
612,1,974,2,House floor back fear behavior brother.,2025-03-22 19:11:14
613,10,133,4,Experience support risk across reach north senior.,2025-02-22 19:37:12
614,8,199,5,Material success list answer give per model.,2025-01-14 20:50:03
615,25,26,3,Home participant phone movie.,2025-02-28 05:59:17
616,11,116,2,Less oil laugh movement away within smile information.,2025-03-19 03:09:03
617,20,90,1,Language paper condition business prevent Congress mother after election close.,2025-03-10 02:11:25
618,23,820,1,Note home huge able country bad.,2025-04-04 09:10:40
619,14,313,1,Bad believe sell since look last picture.,2025-04-13 04:01:57
620,15,838,2,Upon claim what time data.,2025-04-12 18:11:46
621,14,534,2,Public environment nothing moment join stock enjoy draw create.,2025-03-14 08:17:54
622,16,116,4,Research pressure buy throughout nice.,2025-03-05 18:23:28
623,19,466,4,Really provide art hour direction control.,2025-01-24 00:52:30
624,27,947,4,Think world billion pay next leg.,2025-03-02 23:34:34
625,22,291,3,These course institution usually plan high.,2025-01-29 10:05:38
