id,user_id,movie_id,stars,content,created_at
1,4,466,4,Throughout least western until.,2025-04-24 13:24:52
2,7,872,4,Fear debate assume expect hospital nearly.,2025-02-06 21:17:28
3,26,157,4,Glass tree write lose likely yes something moment.,2025-01-27 10:57:09
4,13,893,4,Traditional number more poor together difference office everybody role.,2025-04-18 14:10:24
5,27,871,3,Word else sell consider page choice religious.,2025-01-13 10:28:07
6,27,680,2,Read young remember economic yourself article learn day participant.,2025-01-25 23:57:27
7,26,590,5,Difference month and model bill middle recognize mouth live oil.,2025-02-23 10:04:09
8,19,903,2,Behavior rule work common reduce threat.,2025-02-04 16:34:35
9,13,721,3,Send movement six eat room site sound yourself risk.,2025-03-22 14:36:48
10,16,402,4,Democrat himself goal yeah quickly dinner.,2025-03-16 16:41:28
11,8,169,4,Threat sense something future body improve hand paper.,2025-03-27 20:26:05
12,7,148,1,Various space fight condition happy difference break stop.,2025-02-12 22:08:19
13,12,812,1,Show last perform year.,2025-01-16 10:19:27
14,28,687,3,Far listen employee its price name buy.,2025-04-29 14:53:11
15,23,22,4,Service kind kind event then through rich energy my natural six.,2025-02-14 22:34:04
16,24,158,2,She cold have might whose radio.,2025-02-16 06:40:56
17,1,902,3,Peace candidate sea prevent western short two.,2025-04-22 09:25:44
18,29,439,2,Guy government success gun sit build ball move federal late.,2025-03-18 01:26:29
19,2,443,3,Husband knowledge issue news mission.,2025-02-01 20:58:33
20,23,676,1,Hit full near drop air movie carry at learn relationship.,2025-01-30 01:03:52
21,1,703,2,Factor your continue language chair general.,2025-03-08 12:30:53
22,3,291,4,Give civil section could describe surface scientist.,2025-04-22 07:54:50
23,24,645,3,Shake anyone inside I medical TV group.,2025-05-05 21:02:37
24,14,452,3,Woman test son drop market move model born office benefit.,2025-03-09 05:36:47
25,29,746,4,Type push four commercial who only represent above spring.,2025-05-03 11:31:49
26,26,230,2,Edge his spring side author me.,2025-04-22 05:45:55
27,27,285,5,Tree fire rise character technology light change voice.,2025-02-03 19:40:24
28,8,316,1,Black get region meet child ability compare.,2025-05-07 12:08:33
29,15,192,2,Nice pay purpose service enjoy reveal fast.,2025-01-06 12:57:13
30,22,809,2,Rest form responsibility trade.,2025-02-08 02:34:44
31,10,131,3,Size simple hand industry financial article before.,2025-04-18 05:50:21
32,11,999,4,Image near red public forward travel approach to.,2025-01-20 22:27:24
33,5,671,5,Director exactly listen general daughter you memory network data red.,2025-04-27 02:45:57
34,1,749,1,Take four dream which school pick.,2025-03-08 22:55:20
35,6,109,3,Successful listen parent different from store.,2025-04-03 19:22:36
36,10,241,4,World recently design research seat fund book employee.,2025-02-09 07:12:17
37,1,228,5,Marriage thought someone choice service.,2025-03-08 12:34:02
38,16,760,2,Truth state food fight half increase include building once machine.,2025-01-20 08:53:44
39,19,372,4,Environmental attorney issue wear expect human win time.,2025-02-18 10:11:49
40,1,586,2,Care of enter democratic along father situation painting model official.,2025-04-29 04:27:21
41,7,57,3,Sure first they away option probably pay phone.,2025-02-22 23:41:11
42,19,943,4,Treat spend score bank space open.,2025-03-29 02:40:47
43,27,833,2,Knowledge television may change usually apply far successful line so.,2025-03-06 05:28:03
44,29,496,5,Military especially always side respond ten she prepare boy pick.,2025-03-31 11:40:53
45,26,804,3,Light product machine respond them friend.,2025-02-14 16:46:25
46,14,393,2,Spend camera wonder politics enjoy later heart partner difficult suggest.,2025-03-24 19:52:55
47,20,370,5,Former page image require.,2025-02-22 07:11:41
48,24,848,5,Oil market style agreement clearly wide.,2025-03-15 14:15:28
49,14,887,2,Forward television finish lead lose expect trade successful walk month.,2025-01-27 02:44:13
50,6,677,4,Third rise car sense PM.,2025-01-26 18:25:14
51,3,697,1,Radio attack use recent service TV certainly seem several protect.,2025-04-28 04:01:10
52,30,723,3,Church yard night born since floor evening of hospital student.,2025-02-03 06:31:26
53,10,235,1,Thing fact send message product not story property already.,2025-01-10 00:38:03
54,6,867,3,Energy yeah read bill participant.,2025-01-27 07:42:50
55,29,282,2,Leader street protect test daughter.,2025-03-27 17:47:10
56,21,225,2,System citizen buy age.,2025-04-18 04:17:30
57,8,711,2,Seem modern wide quickly inside baby.,2025-02-02 07:13:12
58,22,648,1,Their democratic why while.,2025-05-06 00:13:53
59,28,746,1,One house hit question recent generation test purpose knowledge.,2025-04-14 08:49:43
60,12,478,5,Real but drop suffer organization executive room.,2025-04-11 14:50:31
61,3,675,4,Performance factor pay for should brother physical.,2025-01-03 02:36:41
62,13,322,5,Floor key network new example example.,2025-04-16 18:37:21
63,18,75,2,Try federal human of system such mother land policy.,2025-02-16 08:56:25
64,6,74,2,Process collection these surface write blue.,2025-04-11 03:58:07
65,7,118,4,Long space great real set about position coach.,2025-01-10 05:57:36
66,10,380,4,Move candidate oil impact beautiful my job beyond.,2025-02-02 04:49:05
67,19,329,4,Become month improve south two indicate behavior son.,2025-02-13 18:21:32
68,24,5,1,Increase seem western group through suddenly candidate budget street north.,2025-03-20 01:12:45
69,18,488,5,Group off truth tend buy level.,2025-04-24 05:33:13
70,11,601,5,Happy test level school claim respond use.,2025-01-07 17:03:33
71,30,838,5,Strong in have could vote drop.,2025-01-10 23:52:11
72,5,519,5,Market western dog by if.,2025-02-03 07:40:22
73,12,276,2,Investment American country room professional picture world lose part.,2025-01-10 11:00:00
74,1,746,3,Fly lot degree pay full wide item hear.,2025-01-26 21:49:42
75,5,535,4,Choose member allow whether husband water image accept popular teach let.,2025-04-16 13:44:00
76,28,255,2,Able two end hospital firm girl level.,2025-03-09 22:21:07
77,22,578,1,Safe reason base hundred military play present edge child sea.,2025-05-06 03:59:46
78,7,61,2,Hair begin several new let let reach board.,2025-01-07 10:37:29
79,7,70,3,Military add piece south individual nothing.,2025-01-01 03:44:22
80,29,927,1,Return enough various if my dream southern culture camera section.,2025-02-27 02:41:58
81,20,832,1,Also back major edge avoid wonder.,2025-02-02 22:33:26
82,11,914,5,Pm style arrive country send sort.,2025-05-07 20:04:47
83,10,428,5,Cover usually drop southern individual church probably blue.,2025-04-08 07:14:10
84,30,408,4,National talk war hundred full fill put culture wrong.,2025-01-26 23:18:59
85,10,127,3,Sit peace return before mention author point project professor.,2025-01-11 13:01:22
86,16,444,2,Eye full third feeling break act catch.,2025-05-01 08:10:47
87,15,147,3,Help laugh have yard test.,2025-02-07 07:49:42
88,30,152,5,Choose politics with very say American conference.,2025-02-23 02:35:47
89,16,475,1,Office action put structure interest since least help.,2025-01-07 15:30:40
90,13,83,5,Institution off everything vote report.,2025-03-15 11:58:18
91,23,713,2,Particularly herself task your inside individual sometimes.,2025-01-14 05:54:17
92,13,447,3,Whole wrong short live commercial shake as huge case media.,2025-04-30 11:05:34
93,11,138,3,Run around class information none day unit.,2025-03-22 20:35:31
94,14,219,4,Project knowledge culture recognize up seem.,2025-03-27 07:57:59
95,29,741,4,Every available paper population forget later.,2025-01-28 17:42:20
96,22,814,3,Act many property loss.,2025-02-18 15:30:55
97,25,669,5,Four voice any admit show account job thousand dark.,2025-03-10 21:10:16
98,30,158,1,Figure black now spend left study behavior security still.,2025-03-29 12:48:45
99,16,117,2,Rule various road even sure cost.,2025-04-13 05:40:20
100,24,726,5,Building bank bring suddenly value Mr.,2025-03-20 18:38:28
101,29,585,2,Nation crime factor cup lead.,2025-03-21 23:10:39
102,14,143,5,Draw civil law across air democratic outside society meet would.,2025-02-13 17:25:33
103,12,58,3,Necessary window whole return national such place course room discussion.,2025-01-10 20:42:06
104,23,790,1,Heart great born all decide.,2025-02-21 21:43:27
105,6,959,3,Realize best letter campaign.,2025-02-24 09:27:19
106,13,738,4,Generation possible white business value tough make seem economic.,2025-04-16 17:51:56
107,5,588,2,Save also both for live talk scientist pretty man that all.,2025-03-01 05:29:19
108,14,790,4,About lead plant mouth lose.,2025-04-03 18:37:17
109,4,827,2,Minute available despite wife company lead anyone him fire.,2025-03-30 00:41:50
110,11,568,1,Part great soldier school weight strategy worker same toward reason.,2025-04-28 18:12:20
111,26,954,2,End quite idea practice.,2025-02-26 02:13:53
112,18,868,4,Whom may must fund must race indeed song trial book.,2025-04-16 17:51:28
113,17,357,3,Energy strategy business believe soldier few whatever positive.,2025-02-10 08:45:40
114,8,828,3,Only argue anyone speak on drive into establish.,2025-03-08 00:32:29
115,18,387,5,Tonight spend home defense through.,2025-04-06 22:14:02
116,7,299,4,Hand discussion month what development policy will smile dark radio.,2025-02-13 15:26:54
117,30,495,1,Spend throughout each movie treatment.,2025-04-29 04:04:34
118,21,98,1,Listen three hard reality draw civil federal mother low.,2025-03-20 23:36:27
119,9,380,2,Fire section draw close bring beat baby action surface attention.,2025-04-23 18:30:19
120,27,693,1,Involve test after minute enter quite hold building arrive success.,2025-02-26 18:55:57
121,4,337,2,Allow wall method window beautiful pressure later.,2025-04-14 16:28:07
122,12,976,1,Within party current surface southern land politics.,2025-03-15 02:14:25
123,24,466,4,Foot some almost message generation foot fact somebody almost police.,2025-03-07 14:27:57
124,19,319,5,War dream everybody significant against push.,2025-01-10 23:56:50
125,29,846,4,Attorney soon activity once standard out group hair Congress.,2025-01-01 10:53:54
126,18,359,3,Per walk by data policy wait report whether anyone.,2025-02-21 05:48:25
127,12,309,4,Son ground next a pattern.,2025-04-18 01:39:29
128,17,707,3,Think smile each order actually room policy them.,2025-02-18 13:01:10
129,3,29,5,Senior bag front how pattern family student.,2025-04-12 04:13:46
130,4,605,5,Ok think relate in inside threat first.,2025-04-18 00:18:40
131,24,518,3,Contain give six site not serve month base gun civil.,2025-04-26 01:14:41
132,6,435,1,Boy former today expert age.,2025-05-05 16:21:35
133,9,193,2,Particularly nothing sometimes suddenly real along line.,2025-01-13 04:23:07
134,24,60,5,Responsibility clear especially everything simply choose though almost subject increase.,2025-04-11 11:00:37
135,9,687,5,Daughter state same discuss practice available.,2025-05-08 15:19:54
136,19,277,5,Discuss cup hot than reason popular development three information nature.,2025-04-08 15:04:35
137,26,366,5,Mention pattern foot color around baby figure.,2025-02-03 20:10:22
138,9,625,2,Mean perhaps minute some officer speech computer able.,2025-03-11 16:49:12
139,13,457,2,Reality sport start area like identify service.,2025-03-18 23:13:25
140,16,43,2,Specific drop medical they cultural.,2025-04-04 02:39:23
141,5,450,5,Image contain specific word animal now phone treat audience.,2025-03-04 05:28:27
142,27,417,4,Worker score yourself always go our food investment detail treat mouth.,2025-02-03 04:35:30
143,1,614,5,They management after position and.,2025-04-04 07:01:51
144,26,380,1,Half arm almost usually for human threat memory commercial.,2025-01-12 18:19:14
145,11,228,1,Citizen seem director trip behavior once time herself.,2025-01-30 22:45:58
146,12,465,5,Analysis price marriage nation deep manager simple five food actually.,2025-01-23 23:21:53
147,8,950,5,Level chance why answer chance.,2025-01-15 16:06:36
148,28,159,4,Fire carry free explain agreement meet certain learn good send.,2025-02-22 18:17:25
149,16,74,5,Program whole magazine fine maintain somebody.,2025-04-18 13:38:00
150,12,469,1,School face become democratic instead morning provide image affect rate ask.,2025-02-11 12:07:19
151,29,538,5,Alone gun box each current need share with.,2025-03-13 13:00:56
152,23,49,3,State day follow full next serious relationship member but.,2025-04-08 14:58:24
153,3,927,1,Administration argue tend poor offer responsibility condition stuff off.,2025-02-15 21:18:31
154,23,557,1,Beautiful theory almost occur statement painting.,2025-01-08 22:15:38
155,13,93,1,From expert note me yeah must throughout nor administration.,2025-04-24 22:35:20
156,3,109,2,Form page mention to still stop.,2025-03-13 14:57:46
157,27,979,4,Open while can certainly they staff table.,2025-01-21 03:06:58
158,15,232,2,Property nor shake help American.,2025-02-27 23:14:43
159,18,151,4,She hand one art that young stop others.,2025-02-22 22:00:20
160,6,665,3,Third not certainly article play brother time long say.,2025-04-14 02:18:13
161,26,86,2,Voice low not five see step include allow reduce first.,2025-05-08 09:29:56
162,20,573,5,Quality news represent data trouble.,2025-05-08 19:09:36
163,21,260,1,Final discuss ball term free can Mrs.,2025-03-04 00:42:00
164,28,732,3,A clearly light board.,2025-04-19 05:36:39
165,16,403,2,Modern industry effort health simply foot why daughter send.,2025-03-06 11:16:01
166,3,265,1,Them popular science body next suffer subject let.,2025-04-12 05:21:24
167,5,915,5,Cup hot send lead since trouble boy face style top yes.,2025-01-24 13:17:27
168,22,855,5,Central director respond music I allow care.,2025-02-18 02:01:01
169,14,321,1,Pattern magazine still order wait so.,2025-03-27 22:10:05
170,29,501,4,Day style recently decade artist yeah difference.,2025-05-03 02:27:51
171,18,348,3,Factor serve reason response say however happen all probably stuff.,2025-04-03 06:17:59
172,12,457,4,Lot ground manager church blood everybody.,2025-04-23 01:38:51
173,24,147,4,Couple on director describe resource group research mean make safe.,2025-04-02 08:13:04
174,30,225,5,Main president response power purpose.,2025-01-13 18:36:06
175,1,498,1,True man feeling there eat property room power identify.,2025-04-15 00:55:27
176,23,246,3,Carry vote air explain center performance.,2025-04-30 18:41:25
177,19,731,2,Turn item a form through difference present mention from.,2025-05-02 07:52:15
178,14,668,3,Fear American thought tree democratic middle within parent toward sure.,2025-01-22 18:45:01
179,23,687,5,May firm professor range Congress final my.,2025-05-04 17:38:35
180,9,450,1,Suffer recognize price seek note easy energy spend.,2025-03-06 06:52:24
181,1,104,4,From everybody against specific run better arrive stock minute.,2025-01-26 12:36:22
182,24,884,4,Light itself fish base project short.,2025-03-23 03:42:45
183,25,923,1,Most attack stage wife far.,2025-04-12 01:13:48
184,11,660,4,Occur guess guess poor behind certainly low just technology.,2025-04-09 22:05:25
185,17,858,5,Indeed claim ground official assume crime while successful.,2025-01-28 02:45:31
186,12,546,4,Prove above two election finish beyond person for reason thus.,2025-05-06 12:24:42
187,4,329,4,Bring company wear business unit.,2025-03-31 18:56:20
188,17,376,3,Tv quality she challenge successful work test again.,2025-03-19 12:39:45
189,25,981,2,Way full prepare money health available.,2025-01-27 03:10:53
190,20,697,4,Edge fight program kitchen morning moment ask.,2025-01-27 06:53:15
191,15,167,3,Point bit someone reality impact news.,2025-05-06 10:34:20
192,6,82,2,Future task understand response fear analysis forward similar that.,2025-03-09 23:46:49
193,1,972,2,Out remain radio onto him tell ever story.,2025-02-27 19:04:04
194,15,380,4,Statement stage middle case anything foreign many performance piece career.,2025-01-17 17:38:53
195,19,237,3,Letter claim summer page kitchen agreement sea team create.,2025-04-06 08:02:44
196,25,732,1,Fine true production policy project start they begin point feel.,2025-05-02 14:30:58
197,20,695,5,Watch then out receive police front carry medical foreign turn same.,2025-03-04 11:43:58
198,21,724,3,Crime seat section know air investment loss walk.,2025-01-21 18:22:56
199,7,688,2,Walk yet section short usually vote.,2025-03-21 14:16:33
200,14,888,1,Step interest happy lay.,2025-01-05 23:28:55
201,13,975,4,Good collection exactly simply knowledge option help.,2025-02-12 13:45:45
202,17,808,5,Record purpose drive difficult already allow strong market hard.,2025-04-23 17:36:54
203,20,457,3,Near painting behind enter day notice.,2025-04-20 16:29:05
204,12,167,5,Word example box both sort rise those week entire owner.,2025-04-26 13:25:37
205,20,866,2,Director behind camera herself test candidate they discover ahead.,2025-03-01 18:08:55
206,17,183,2,Owner already court agent often need may.,2025-03-14 16:26:23
207,14,880,3,Director house about really though section enter against.,2025-05-02 00:15:34
208,27,413,2,Former arrive easy meeting.,2025-03-30 12:26:18
209,20,611,4,Prevent matter skill school enjoy.,2025-04-11 15:04:17
210,26,705,1,Available performance detail organization country half.,2025-04-16 22:53:00
211,27,784,3,Certainly allow hold state author himself economy ever top example.,2025-03-29 13:38:23
212,20,895,2,Trouble once between make economy research office officer newspaper.,2025-05-04 16:24:41
213,8,428,2,Move at despite administration various difficult professor answer organization.,2025-03-29 13:50:43
214,13,151,4,Someone upon mouth card long these thank.,2025-03-02 23:59:51
215,23,530,5,Through per perform mouth his board house.,2025-04-27 02:55:21
216,4,402,5,Pay movement mention offer coach.,2025-02-22 06:18:03
217,24,859,2,Nation hand personal over society along.,2025-01-28 21:53:29
218,18,438,4,Despite not think recently skill unit occur force.,2025-01-09 12:40:35
219,30,10,1,Play I unit win let.,2025-01-14 13:41:29
220,30,635,5,Piece nearly sound send foreign represent.,2025-04-06 09:25:30
221,9,421,3,Possible impact truth treat ok.,2025-01-30 08:45:58
222,18,749,4,Skill less same prepare prove financial generation.,2025-02-19 10:49:11
223,23,278,4,Manager ask level shake least culture.,2025-04-15 03:21:07
224,14,482,5,Material drop each everybody trade.,2025-02-26 03:54:39
225,14,527,3,Visit hotel fish ability including drive pressure air indeed question stuff.,2025-03-15 01:53:48
226,25,738,3,Section including anyone eat only.,2025-03-30 08:53:29
227,29,678,1,Gas force forget administration ready each nice among common general several.,2025-02-09 17:17:21
228,10,105,4,Eight computer executive dinner away way some.,2025-04-27 01:19:14
229,24,892,4,Method test prepare eye herself old health exist stock.,2025-02-06 04:56:14
230,9,590,5,Really collection must free total sure real.,2025-05-01 11:41:47
231,5,704,4,Standard operation without vote commercial.,2025-02-13 02:54:43
232,28,943,5,Color agree for bag.,2025-03-20 19:05:15
233,20,980,2,Toward couple clear whose consumer contain player.,2025-02-10 12:15:08
234,15,859,5,Card throughout goal officer she role.,2025-02-27 02:41:19
235,13,514,2,Someone choose interest investment decide edge herself morning.,2025-05-03 12:19:37
236,7,869,3,Treat true spring line president newspaper run program hard along.,2025-03-11 23:20:59
237,24,733,5,Huge national possible detail dinner sort wear.,2025-02-28 12:20:58
238,5,936,5,Manage off travel dark record.,2025-02-06 17:50:08
239,28,675,3,Serious move hard forget article design any author.,2025-04-11 09:59:44
240,23,574,2,Identify religious newspaper few present unit cup memory general design.,2025-01-31 13:54:51
241,7,879,3,Sea fall admit can capital opportunity central.,2025-03-25 23:27:15
242,5,195,2,Nearly class run point this business author.,2025-04-02 12:50:17
243,2,269,1,Ever party prove society partner.,2025-01-08 11:13:43
244,7,744,1,Whether Republican while middle suffer world good wide.,2025-02-23 21:13:12
245,17,167,2,Able goal employee value any suffer body land gas onto.,2025-04-27 23:20:46
246,26,440,1,Soldier PM base then agent say our most.,2025-03-25 07:38:32
247,4,27,2,Quite president which throughout shake night they section father.,2025-02-19 23:16:48
248,21,201,3,Activity special may some goal.,2025-03-08 23:46:21
249,4,240,2,Few push expert administration trade scientist civil.,2025-01-30 18:27:37
250,30,352,2,Agreement blood me prevent measure smile institution court tax mother.,2025-01-27 16:32:41
251,1,625,2,Clearly building possible energy from manager concern order perform radio.,2025-01-13 20:58:35
252,27,753,2,Stop play yes worry.,2025-05-05 05:14:21
253,25,661,5,Several popular apply anything me response lay.,2025-02-06 00:09:22
254,14,587,5,Chance skin staff international someone.,2025-02-25 18:39:23
255,3,857,4,Would hour together arrive wife on article her.,2025-04-04 03:44:47
256,28,612,4,North another eye charge affect actually can environmental also.,2025-03-11 23:08:39
257,22,217,2,Bar month place history impact with lawyer through.,2025-03-10 14:55:44
258,4,87,1,Myself nothing help certain do strong throw choose instead medical.,2025-02-26 14:37:19
259,17,809,5,Represent continue approach billion sound customer expert family site.,2025-04-19 12:52:14
260,30,9,4,Difficult draw check success economic.,2025-04-28 22:55:04
261,13,692,3,Daughter operation its age green would enjoy dark top number.,2025-05-01 15:20:11
262,6,191,2,Culture attention pay support so wall course eat price.,2025-03-01 00:18:05
263,12,350,2,Game and us some.,2025-03-09 18:56:29
264,29,697,3,Enough author learn off program either phone sign.,2025-04-12 07:07:17
265,18,277,2,Already attorney range important.,2025-02-11 18:23:12
266,24,665,3,Civil do type magazine ever both.,2025-01-26 05:05:49
267,16,574,3,Watch now system phone hotel wall impact believe subject environmental.,2025-01-10 08:17:25
268,8,581,4,Summer tend need do want fund wonder.,2025-01-29 10:43:51
269,2,472,2,Around radio play four drop work year.,2025-02-15 20:01:25
270,5,279,1,Who matter either property which movie significant.,2025-01-25 17:56:54
271,18,214,1,Trouble toward admit company peace mind exactly hotel shake.,2025-03-19 02:48:48
272,27,798,4,Authority less environment call bar although call start herself whom.,2025-04-26 09:57:54
273,23,838,4,Education wall suddenly employee Congress.,2025-01-17 16:21:18
274,28,599,4,Method card radio claim economy number Republican run real.,2025-05-07 15:53:02
275,30,284,5,Place seven economy method participant without interview grow.,2025-03-31 09:52:54
276,10,852,2,Go their least central.,2025-02-12 00:17:30
277,24,976,2,Ball open medical prove worry explain.,2025-04-26 11:19:05
278,8,423,5,Realize west effect organization research share.,2025-02-01 00:36:50
279,10,306,5,Rise rise response daughter table sense meet public a key.,2025-01-18 23:47:02
280,28,889,3,Painting its game team movement big window bag book north.,2025-04-14 08:55:42
281,19,925,3,Daughter month toward quickly important.,2025-04-03 05:17:16
282,21,737,3,Admit write although stock.,2025-04-17 03:04:49
283,30,837,1,Evidence as prove program throw discuss reach daughter water movement.,2025-04-20 04:20:15
284,12,511,3,Before several little together whose share day expert.,2025-03-31 13:13:18
285,7,459,4,Short Mr enjoy evidence best father.,2025-01-22 00:43:18
286,20,531,4,Make never cut develop same.,2025-01-20 12:34:30
287,8,540,1,Down himself building enough successful.,2025-03-20 23:19:08
288,7,690,5,Work themselves rise plan face least car agreement officer last.,2025-03-07 13:08:46
289,4,786,2,Side free perform maybe than peace.,2025-01-26 02:47:42
290,10,631,1,Father particularly economic develop add.,2025-02-23 16:54:26
291,11,496,1,Huge find full system plant media.,2025-02-23 02:03:15
292,14,882,1,Child answer thousand over long success.,2025-01-15 04:25:20
293,21,795,2,Should his green note enough.,2025-03-12 00:59:39
294,26,709,4,Bring me this enter meeting mean.,2025-01-19 11:05:04
295,24,396,4,Smile fly process charge pattern language behind argue father.,2025-02-08 22:46:13
296,16,24,1,Subject involve dream shake lead.,2025-04-29 01:10:41
297,29,987,3,Return million help policy itself.,2025-04-15 15:43:42
298,2,41,3,My scientist boy I best detail my during step west.,2025-03-10 12:20:38
299,2,518,3,View city change trip leader often paper carry and.,2025-04-24 07:49:14
300,13,420,3,Be growth ever clear top local voice off foot officer.,2025-04-25 03:22:11
301,25,290,2,Power well hard turn detail.,2025-04-19 16:14:26
302,4,360,1,Fight drop would professional hand score.,2025-01-13 04:08:04
303,24,225,3,Minute leg fight town response suffer authority imagine according until.,2025-05-03 17:53:05
304,8,17,2,Easy agent he learn tell above plant human.,2025-02-11 07:33:46
305,14,644,5,Kid project particularly food future space her.,2025-02-03 00:32:24
306,14,122,3,Bill already hand record behavior finish administration.,2025-02-07 14:39:05
307,29,49,3,Strategy organization fish amount age resource better late nothing join.,2025-01-25 11:55:07
308,16,788,1,Report bed trip owner natural already chance despite.,2025-04-09 23:32:30
309,21,309,1,Medical must team student suffer dream region end wide guy.,2025-02-23 15:15:50
310,22,553,5,Son far end air subject social yet.,2025-05-02 13:59:58
311,29,998,2,Community relate practice development interview we.,2025-04-10 09:24:11
312,3,34,1,Involve Mr outside leg ability project drive just.,2025-03-04 19:31:01
313,16,946,3,Education read beautiful drug under pattern.,2025-01-19 08:14:18
314,15,920,4,Election nation reflect tonight fight decision suffer.,2025-01-19 10:58:42
315,6,91,4,Through sit travel magazine son prepare.,2025-01-25 08:58:02
